"nominator","school_id","school_name_n","school_city_n","school_state_n","school_district_n","nominator_reason_n","year"
"Anonymous",395,"Missisquoi Valley Union Middle and High School","Swanton","Vermont","Missisquoi Valley School District","The leadership team at Missisquoi Valley Union (MVU) Middle and High School was able to hold two preliminary meetings and a train-the-trainer workshop focused on equity literacy with Paul Gorski. All members of the MVU Diversity, Equity and Inclusion Committee (DEI) Committee have a solid understanding of the principles and practices of equity literacy in education.  Educators from Swanton and Sheldon were intensively introduced to these principles and practices.  At MVU, several members of the DEI Committee feel fully prepared to plan and offer equity literacy professional learning to the staff. Additionally, an equity student survey was created, and feedback provided by the Equity Literacy Institute.  Educators secured funding to get the results of the survey professionally analyzed through an equity lens.   MVU has met the expectation of Proficiency-Based Learning with a thoughtful transition.  Early work was done 7 years ago to prioritize standards and create clear learning expectations, learning scales for common summative assessments, and school-wide habits of work.  Over the past 4 years, educators have implemented a more refined version of proficiency-based learning which includes a transition to proficiency-based grades, personalized course offerings, and robust and flexible â€˜keeping up and catching up' interventions.  As a highlight, the English Language Arts department has wholeheartedly embraced independent reading.  Students now meet their reading proficiencies by providing evidence from books that they choose.  Over the past 5 years, MVU has intentionally designed programming and interventions that prioritize students who struggle academically so that all students achieve at high levels.  Most recently, educators have invested in learning about the Equity Literacy model in order to ensure that they address the needs of historically marginalized students.  This work began with a Diversity, Equity and Inclusion Committee, which started as a group of committed and passionate teachers and has grown to impact and influence the broader school community and district.  The committee pursued grant funding to acquire training to become Equity Literacy trainers and bring the Equity Literacy model to the entire faculty. In the process, the high school committee formed partnerships with two local elementary schools and the Abenaki community. Though COVID has delayed training the rest of faculty in Equity Literacy, the DEI Committee has been busy at work to bring their Equity Literacy lens to the culture and operations of the school. Recent Work: â€¢	Facilitate and support a student DEI group. â€¢	Collaborate with the Pride Alliance and National Arts Honor Society to have students paint a rainbow crosswalk at the school entrance. â€¢	Provide resource guides to teachers to help students process racial unrest in April and the election in November. Current Work: â€¢	Reviewing the Social Awareness portion of the MVSD SEL Competency Guide to recommend strategies that are equity minded and promote equity. â€¢	Collaborating with students to have a Land Acknowledgement as part of the schoolwide routine. â€¢	Supporting students in their efforts to fly the Black Lives Matter flag at school. Work that is being planning: â€¢	Administering an Equity survey to students and then analyzing the data. â€¢	Begin Equity student focus groups. â€¢	Begin an Equity Competency framework.   As a result of the transition away from traditional grades to proficiency-based grades, educators are thinking about how we recognize and acknowledge students. They are working to expand measures of success. â€¢	MVSD has developed and is implementing PK-adult SEL competencies. Teachers are exploring and trying strategies now.  They are beginning to plan for how to communicate student progress on these skills to students and families. â€¢	In grades 9 and 10, MVU offers an Honors Credential instead of tracking students in homogenous groups.  Students are heterogeneously grouped but can opt into an Honors supplement, which runs as an addition to the core class.  The Honors Credential focuses on the content and work habits that students will need to be successful in college. â€¢	The ELA department also created two Senior level English courses to help prepare students for a variety of future choices. One class was a College Writing class, where students are taught how to be successful in their college courses. The other is Technical Reading and Writing, which is a course that focuses on reading and writing skills that are used in the workforce and at trade schools.   MVU has several course offerings that use a project-based learning approach. Humanities in Action is an option that students can take to demonstrate proficiency in ELA or Social Studies.  Students conduct a sustained inquiry, engage in problem solving, and share their findings with their peers and sometimes the greater community.  In the Agriculture program, students in the Animal Science strand identify an animal that they are interested in learning more about. Faculty then acquire that animal, usually on loan, to house in the barn at MVY so that the student can learn firsthand about the animal through observation and caring for it. Additionally, students at all grade levels participate in a robust STEM Fair.  Students conduct sustained, independent research projects that focus on the Science and Engineering Practices in the NGSS.  MVSD has developed the first set of Social and Emotional Learning competencies in the state of Vermont.  In a collaboration with CASEL, the SEL team developed a framework of skills, goals, and sub-goals, benchmarks, and strategies for PK through adults.  Teachers use these competencies to plan lessons that incorporate CASEL's 3 signature practices of Welcome Activities, Engaging Strategies, and Optimistic Closings.  MVU is in its 4th year of working with Think: Kids and using the Collaborative Problem-Solving approach with students.  Three staff are training to become certified Think: Kids trainers in order to grow the capacity to use Collaborative Problem Solving schoolwide.",2021
"ExcelinEd",396,"Quest Academy","West Haven","Utah","Quest Academy","Nicki has belt an exceptional school culture focused on student-centered learning and excellence.",2021
"Anonymous",397,"Williams Elementary School","Pasadena","Texas",NA,"Unlike many Houston schools that struggled to conduct remote learning in the spring and fall, Williams Elementary School thrived despite facing some of the biggest challenges besides the pandemic. Nevertheless, students have continued to stay highly engaged in their learning and attendance has remained upwards of 92 percent right through until the end of the 2020 school year. This rate has remained throughout this fall.",2021
"Anonymous",398,"Sam Houston Collegiate Preparatory Academy","Midland","Texas",NA,"Sam Houston is in year 1 of implementing the Third Future Schools model, which has completely changed the culture of the school and opportunities for students. The model focuses on personalized learning and direct instruction with a focus on meeting more than solely academic needs.   Personalized learning is an approach to instruction that is centered on the student. It taps into a student's needs, strengths, and interests to engage students and to provide a â€œbest fitâ€ education for each student. The instruction is tailored to the individual needs of the student, and students learn in a way that best meets their learning style. Third Future's personalized learning program features four distinguishing characteristics: 1. Learner Profile is a summary of the student's academic history, strengths, interests, social-emotional needs, and how he learns best. It is developed with the student and the parents in order to let the school know how to provide a tailored education that meets the individual student's needs and goals. 2. Student Learning Plan is the individualized, academic plan that will enable the student to reach academic proficiency and meet his other learning goals. It outlines the part of a student's curriculum that will be taught directly and the activities and lessons that will be customized for the student. 3. Flexible Learning Environment allows students to have a more tailored schedule and allows the teacher to use multiple strategies to differentiate instruction. Students may receive some instruction in a large group (25 students) or work in a small group, with a partner, or by himself. With the help of technology, and because the doors of the school will be open from 6:30 a.m. until 6:00 p.m., students may also learn before school, after school, or at home. 4. Competency-Based Education allows students to learn at their own pace. If a student has already mastered an objective or standard, they can move on to accelerated objectives or to a topic related to their other learning goals. If a student is struggling with a particular concept, she can take more time and received more individualized or small group instruction.   Third Future is also implements the """"dyad"""" concept that establishes requirements for experiences that are often only available to students with means, such as participating in sports, learning an instrument, traveling, and more. Third Future provides these experiences to students who are not able to afford them.   Students in the upper grades at Sam Houston also take a course called The Art of Thinking. To my knowledge, Third Future Schools spend the most time on teaching critical thinking and informational literacy, which is so critical to our current society.   Finally, Sam Houston is currently open from 6:30-4:30 (and even later outside of the current pandemic), which provides families free before and after school care. Sam Houston has done an incredible job operating (safely) during the pandemic and was featured in the local news paper. The school offered in person instruction much earlier than other local schools.",2021
"Fielding International",399,"Hilton Head Christian Academy","Bluffton","South Carolina",NA,"Over the past four years, Hilton Head Christian Academy has partnered with Fielding International to design, develop, and deliver the best combination of educational spaces and learning strategies, as the school transitions from traditional teaching methodologies to project- and inquiry-based, experiential learning practices.   During the building development phase, the design team worked closely with regional architects to blend Hilton Head's natural environment and school culture into structural realities.  A large investment into on-site exposure and training aided the entire school community in understanding the value of open-design concepts, why seating and learning communities need to be flexible and serve multiple purposes, and how to maximize authentic learning opportunities within and around the physical building.  Consistent reviews of best practices and local regulations mirrored the academic process underlying the pedagogical shift and engaged a multitude of stakeholders (families, faculty, community, alumni, and students) in the design process.  Increased student voice and agency in the means by which learning can happen manifest a more interactive approach to learning at school; even under the current, physically-distanced limitations, the pillars for collaborative, creative, and authentic learning communities have been placed.  From these foundations, we look to continue to reimagine the way students can take on learning and create authentic and actionable community connections.",2021
"Anonymous",400,"Legacy Prep","Birmingham","Alabama","Legacy Prep","Legacy Prep is making history as the first public charter school in Birmingham and is founded by a Black woman. Additionally, Legacy's model incorporates a beautiful medley of quality academics, performance and visual arts, and SEL/habits of success.",2021
"Anonymous",401,"University Charter School","Livingston","Alabama","University Charter School","The impact that UCS has had on the local community that it serves is transformational.  The TODAY show did a feature story on UCS as well as it has been recognized by the USDOE as spotlight school.  UCS is truly â€œrootedâ€ in place and is grounded by the place-based educational philosophy that education has a local to global context, establishes community, and focuses on a learner-centered, design thinking approach.  The school climate at UCS is focused on students as individuals and schools as communities, tapping into resources and interests in students and all stakeholders to foster an engaging, collaborative learning environment focused on growth.  University Charter School is a PK-10 community, not just a school, as evidenced by the level of community engagement and partnership.  The formal place-based education approach at UCS is linked to higher academic achievement, energized teachers, transformative school culture, improved student learning, and an impact on students to become active citizens and improving connections between schools and â€œplaceâ€, the local community.  UCS is truly â€œrooted in placeâ€ in rural, Sumter County.  Serving students in the west Alabama region of Alabama's Black Belt brings many unique challenges that UCS embraces as opportunities to make a real difference in the lives of the students, families and communities that it serves.  UCS was established to change the educational and economic landscape of the community. UCS is intentionally designed to equip students with essential skills to help revitalize their community and to attract business and industries back to the community by focusing on a robust interdisciplinary curriculum focused on college and career preparation.  The community, the place, is instrumental and foundational to the mission of UCS.",2021
"Anonymous",402,"i3 Academy","Birmingham","Alabama","i3 Academy",NA,2021
"Anonymous",403,"Desert Spirit School","Glendale","Arizona","Glendale Elementary District","Desert Spirit has adopted using a blended learning model while teaching virtually. Teachers have taken the traditional definition of blended learning and are adjusting it to their current reality. While virtually teaching the students are in small groups, working independently on various websites, doing guided reading, etc.   Desert Spirit has also received a grant from Verizon and has become a Verizon Innovative Learning School {VILS}. This grant has allowed our site to become a full 1:1 school. So even though we are virtual each student in the household will have a device. All of our 4-8 students have an ipad that was provided in the grant. Our K-3 students are using our chromebooks. We were then able to loan out extra chromebooks to other sites that didn't have enough devices so that those students would not need to share either.  This grant has also provided multiple Professional Development for our teachers to help them with understanding and implementing blended learning in the classroom.",2021
"Anonymous",404,"Palo Verde Elementary School","Casa Grande","Arizona","Casa Grande Elementary District","Our oldest school, Palo Verde has very high rates of student poverty, and was plagued for years as a school with a bad reputation. It was """"that"""" school on the south side of town. However, with strong leadership and a focus on becoming the best kept secret in Arizona, their academic achievement has improved every year for the past 4 years. They've focused heavily on building a community of learners, leaders, and innovators by partnering with various organizations to bring STEAM education into their routines. They've also embraced Covey's 7 Habits to help develop leadership and social emotional learning competencies for students and staff, and are working to become a Leader in Me Lighthouse School. They recently applied for and received recognition as an A+ School of Excellence, which was a huge win for this little place. And although the A+ recognition was great, it probably isn't enough considering the great things happening here.",2021
"Anonymous",405,"Western School of Science and Technology","Phoenix","Arizona","Western School of Science and Technology","WSST has been the highest-performing public high school in Maryvale (on Phoenix's underserved west side) since it opened in 2014.  Its embrace of an equity culture, blended learning, and project-based learning - as well as its exemplar results - set it apart.",2021
"Anonymous",406,"Bioscience High School","Phoenix","Arizona","Phoenix Union High School District","Bioscience HS is one of the highest-performing high schools in Phoenix.  With a unique project-based STEM approach, a collaborative school culture attuned to equity, and phenomenal results, Bioscience HS was recently recognized as a national Blue Ribbon school.",2021
"Arkansas Team Digital",407,"Batesville Junior High School","Batesville","Arkansas","Batesville School District","Overall, BJHS is relatively new to implementing blended learning, so for this school year, what stands out the most is the commitment to being flexible and providing multiple educational avenues for students that have allowed parents and students to select a learning environment that provides security and safety, but also provides a quality educational experience for our students. Teachers have moved to use Google Classroom as the primary interface with students. The Batesville School District has allowed students to choose between 3 different learning environments this school year, based on the parent and student preference. Most of our students are in person or remote, which for BJHS means the student is joining a physical classroom via Google Meet from an alternate location. This allows the student to take part in classroom discussions and have access """"real-time"""" to a teacher but doing so from the safety of their location of choice.  As far as doing things differently, BJHS is a one to one school. All students are issued a Chromebook, and the vast majority of our curriculum is provided via a digital format. Because BJHS had chosen to go one to one a few years ago, the staff and students were already in a situation to pivot to off-site learning when COVID struck our area. Though there were issues to resolve, our district was in a strong position to roll out digital learning to students. When this school year began, all students were given 3 options regarding how they would receive their education. Students were given the option of attending in person, attend """"remotely"""" (which is described above), or attending virtually.   Virtual instruction at BJHS consisted of students accessing courseware via Edgenuity or Lincoln Learning and working at their own pace.  This provided our families and students the ability to select the learning option that best suited their needs. There is no other district in our geographic area that I am aware of that provided this many students' options.",2021
"Aurora Institute",408,"Learn4Life Inglewood - Alta Vista Innovation High","Inglewood","California","Not applicable","Strong competency-based school serving a nontraditional population. ** Please note that Jessica Sherlock is not the principal, she's the network's Director of Center Quality who co-led my visit. I didn't meet the principal and the principal's name is not listed on Alta Vista's website.",2021
"Learning Policy Institute",409,"Felicitas and Gonzalo Mendez High","Los Angeles","California","Los Angeles Unified","Felicitas and Gonzalo Mendez High School, located in Boyle Heights in East LA, is a full-service community school that places its students and their futures at the heart of its equity-oriented vision. Mendez operated as a community school long before it became one of the first members of the Los Angeles Unified School District (LAUSD) Community School cohort in 2019. This means that the school prioritizes the four pillars of a community school: integrated student supports (wraparound services), extended learning time and opportunity, distributed leadership, and family and community engagement. Students understand that their wellbeing is at the heart of the school's mission. In 2019, 85% of students reported feeling safe at Mendez and 81% of students reported that they are happy to be at Mendez (LAUSD School Experience Survey, 2019). At Mendez, student learning is also a priority, and the school's graduation rates have risen dramatically in the ten years since its founding in 2009. The school began with a graduation rate of nearly 50% and now has a graduation rate of over 84%, 90% of whom go to college.  As part of the school's focus on integrated student supports, Mendez High School partners with a number of different community organizations that provide services to students and their families. These community partners fulfill different roles on campus and can engage in case management, put on whole-school events, and offer group supports. Individual case management organizations, like Promesa Boyle Heights or Communities in Schools LA, provide one-on-one supports to students and families, often targeting dropout prevention and academic engagement through mental health supports or other interventions. The school also recently broke ground on a Wellness Center, where it will be able to provide mental and physical health resources to the Boyle Heights community. This Wellness Center is the result of over 10 years of organizing by the school and its community partners.   The school also holds high academic expectations for its students and launched two initiatives that target student learning gains: AP for All and Computer Science for All. As part of these initiatives, all Mendez students take at least one AP course and at least one Computer Science course prior to graduation. Many students choose to continue taking AP and Computer Science courses once they are exposed to the experience. Teachers and parents were concerned at the outset of the AP for All initiative that students would all choose to take AP Spanish, as the student population is predominantly Latino/a/x and there is a higher proportion of English Learners at Mendez than there are across the district and statewide. And yet, students have demonstrated an interest in a variety of AP courses since the initiative began. The school also focuses on the needs of students with disabilities and uses an inclusion model to ensure that students with special needs are given the same opportunities to learn as their peers.   Mendez's principal, Mauro Bautista, models a culture of distributed leadership. This is reflected in many of the aspects of the school, including its multiple governing bodies that include a variety of stakeholders throughout the community. There is a School Site Council, Local School Leadership, the School Culture Committee, the Family Action Team, and the House of Student Representatives. Many of the initiatives that are currently central to Mendez's approach are the result Principal Bautista seeking feedback from educators and families to guide decisions, including the school's Restorative Justice, Computer Science for All, and AP for All initiatives, which were all started by Mendez teachers.  The school has a hands-on approach to family and community engagement, which it leveraged when the pandemic closed LAUSD schools. Mendez staff and community partners reached out to every student and family, and if they could not contact anyone they did home visits. At these home visits, they provided an array of services, including delivering food or supplies and providing mental health check-ins. They also leveraged these relationships with families to determine how to deliver instruction in the Fall of 2020. Teachers, families, and students came together over the summer to determine the master schedule in the fall. They chose a quarter system so that students could focus more deeply on fewer classes and so that teachers would have half of their typical caseload. They began planning for hybrid learning, where students will be on-campus part-time and their instruction will be aligned across the virtual and in-person learning environments.  Being on Mendez's campus is a joyful experience. Students whom you speak with readily share their learning, parents are frequently on campus volunteering or taking classes at its Family Center, and school leaders like Principal Bautista are often wandering the halls or working in the library because they both want to be accessible to the community and because they probably gave their office away to a community partner who is visiting campus. I'm excited to nominate Mendez because it is truly a community-based initiative that puts social and racial justice at the center of its decisions, which are all in service of the bright future of its students.",2021
"National Center for Special Education in Charter Schools",410,"CHIME Institute's Schwarzenegger Community","Woodland Hills","California","CHIME Institute's Schwarzenegger Community District","CHIME's academic model ensures all students are taught in a way that enhances their stregnths while also addressing their learning needs. Their approach to teaching is fully inclsuive, allowing both students with IEPs and without to learn side-by-side with the same high expectations.",2021
