"nominator","school_id","school_name_n","school_city_n","school_state_n","school_district_n","nominator_reason_n","year"
"Big Picture Learning",111,"Latitude 37.8 High School","Oakland","California","Oakland Unified School District","As a school in the Big Picture Learning network, this school supports the organizational mission of activating the potential of Schools, Systems, and Education through student-driven, real-world learning. Its design helps to scaffold and facilitate student learning aligned with the """"10 Expectations"""" (https://www.youtube.com/watch?v=K96c-TGnSf4) and it is organized to implement the """"10 distinguishers"""" (https://www.bigpicture.org/apps/pages/index.jsp?uREC_ID=389353&type=d&pREC_ID=902235) to deliver """"one kid at a time"""" personalized learning situated in the communities it serves.",2023
"NewSchools Venture Fund",111,"Latitude 37.8 High School","Oakland","California","Education for Change Schools","Latitude High School is focused on real world Project-Based Learning, with strong arts, multimedia, and technology integration. From the time they are 9th graders, students visit over ten different workplaces every year to ignite their career interests and to collaborate with professionals on Real World Projects. All students participate in Extended Learning Opportunities, including internships and student-designed businesses. Latitude graduates are confident  leaders, prepared for college and beyond.",2023
"NewSchools Venture Fund",744,"LEAD Charter School","Newark","New Jersey","LEAD Charter Schools","Lead Charter School's model is grounded in the unwavering belief in the power of young people to transform their lives and the community. Our model is developed and delivered by practitioners of research-based youth development practices and systems that ensure a tailored, personalized, strengths-based learning experience, grounded in the advocacy of Opportunity Youth. Our model contains five interconnected core components:
1. Education
2. Construction PLUS
3. Counseling and Counseling Management
4. Leadership Development
5. Graduate Success",2023
"NewSchools Venture Fund",716,"LEEP Dual Language Academy","Brooklyn","New York",NA,"Our students spend much of their school day immersed in the Spanish language—for up to 90% of the school day in kindergarten, then gradually balancing out to 50% of the day in fourth and fifth grade.",2023
"NewSchools Venture Fund",400,"Legacy Prep","Birmingham","Alabama","Legacy Prep","We envision an exceptional educational experience in our scholars’ lives that readies them to establish their legacy, prepared and inspired to create a life full of opportunity, choice, connection and meaning.",2023
"Big Picture Learning",300,"Leominster Center for Excellence","Leominster","Massachusetts","Leominster Public Schools","As a school in the Big Picture Learning network, this school supports the organizational mission of activating the potential of Schools, Systems, and Education through student-driven, real-world learning. Its design helps to scaffold and facilitate student learning aligned with the """"10 Expectations"""" (https://www.youtube.com/watch?v=K96c-TGnSf4) and it is organized to implement the """"10 distinguishers"""" (https://www.bigpicture.org/apps/pages/index.jsp?uREC_ID=389353&type=d&pREC_ID=902235) to deliver """"one kid at a time"""" personalized learning situated in the communities it serves.",2023
"Mastery Transcript Consortium",502,"Liberty Academy","Liberty","Missouri","Liberty Public Schools","This school has a fully implemented mastery-based learning system and uses the Mastery Transcript as the official summative record for some or all graduates.",2023
"Anonymous",750,"Liberty STEAM Charter School","Sumter","South Carolina","Liberty STEAM Charter School","In partnership with our families and the community, our vision is to provide real-world interdisciplinary, personalized, and project-based learning experiences through a STEAM-based academic program where graduates become the next generation of leaders, ​employers, and employees who contribute to the economic well-being of their communities and families.",2023
"Center on Reinventing Public Education",683,"Lighthouse Holyoke","Holyoke","Massachusetts",NA,"Lighthouse offers personalized learning for grades 6-12. Classes are somewhat unvonventional compared to traditional school subjects in that teachers create personalized curriculum based on their expertise; classes are often not restricted to particular grade levels. In addition to small learning spaces, Lighthouse offers an open area for self-directed learning, a recording studio, and a maker space. Although Lighthouse largely operates on tuition-based enrollment, the school has a partnership with the nearby local public school, allowing students who may not otherwise have the opportunity to enroll in a small-group learning envirnment to do so.",2023
"Mastery Transcript Consortium",683,"Lighthouse Holyoke","Holyoke","Massachusetts",NA,"This school has a fully implemented mastery-based learning system and uses the Mastery Transcript as the official summative record for some or all graduates.",2023
"Anonymous",303,"Living School","New Orleans","Louisiana",NA,"Living School cultivates equity by nurturing students to do work that improves their lives, communities, and environment through holistic health, citizenship, & entrepreneurship.",2023
"Anonymous",656,"Lucama Elementary","Lucama","North Carolina","Wilson County Schools, North Carolina","Lucama Elementary and its district are part of the national Opportunity Culture initiative, in which schools extend the reach of excellent teachers and their teams to many more students, for more pay, within regular budgets. Under Principal April Shackleford, Lucama dramatically “exceeded growth” in 2021–22 under the state definition. The foundation of the Opportunity Culture model is the Multi-Classroom Leader role, or MCL—an excellent teacher who leads a small teaching team, providing instructional guidance and frequent, on-the-job development, while continuing to teach part of the time. Under Shackleford, Lucama creatively used resources to take this role and other team teaching roles schoolwide in its second Opportunity Culture year to shift student learning and school culture, and to involve as many teachers, paraprofessionals, and retired teachers serving as paid tutors as possible in providing small-group instruction, to give students in this Title I school equitable access to tutoring during and after school.",2023
"NewSchools Venture Fund",625,"Lumen High School","Spokane","Washington",NA,"Lumen is a unconditional educational model with layered wrap around supports, an on site early learning center and standards based learning that utilizes projects encompassing life skills and deeper learning rubrics to measure outcomes and provide skill building empowered learning for our students.",2023
"NewSchools Venture Fund",626,"Magic City Acceptance Academy","Birmingham","Alabama",NA,"We are a brave and affirming space for all students.  We especially recognize that we are a space for any student who feels marginalized in their current educational setting.",2023
"Barr Foundation",784,"Manchester High School","Manchester","Connecticut","Manchester Public Schools","Comprehensive high school transformation
Learning beyond the school walls
Red Hawk Flight Plan - capstone experiences aligned to portrait of a graduate
Post secondary planning
Academies and pathways
Early college / dual enrollment / career technical education",2023
"Clayton Christensen Institute",122,"Map Academy Charter School","Plymouth","Massachusetts",NA,"MAP Academy has deliberately redesigned high school to support the needs and circumstances of students who have dropped out of conventional schooling. Their courses are online, asynchronous, and competency-based, which makes them flexible to the needs of their students. Nonetheless, their school is located on a physical campus that offers a robust set of academic and non-academic supports.",2023
"Big Picture Learning",305,"Mapleton Early Career Preparation","Thorton","Colorado","Adams 12 Five Star Schools","As a school in the Big Picture Learning network, this school supports the organizational mission of activating the potential of Schools, Systems, and Education through student-driven, real-world learning. Its design helps to scaffold and facilitate student learning aligned with the """"10 Expectations"""" (https://www.youtube.com/watch?v=K96c-TGnSf4) and it is organized to implement the """"10 distinguishers"""" (https://www.bigpicture.org/apps/pages/index.jsp?uREC_ID=389353&type=d&pREC_ID=902235) to deliver """"one kid at a time"""" personalized learning situated in the communities it serves.",2023
"Barr Foundation",783,"Margarita Muñiz Academy","Boston","Massachusetts","Boston Public Schools","Dual language school
City as a campus programming - internships, dual enrollment, community service and expeditions
Culturally responsive
Portrait of a graduate - competencies",2023
"NewSchools Venture Fund",718,"Marin's Community School","Marin","California","Marin County Office of Education","We are excited to offer several alternative programs for students and families who are seeking a smaller setting with a higher staff-to-student ratio, personalized learning, and increased supports so that students we help prepare for college, career, and life. As we challenge the traditional identity of alternative education programs, we encourage referrals earlier for students who would benefit from the programs we have here.",2023
"Anonymous",751,"Maritime High School","Des Moines","Washington","Highline Public Schools","Maritime High School connects students with hands-on, project-based learning to create access to local maritime careers and open doors to college. Anchored in the Duwamish Valley, we deliver powerful youth development experiences and exceptional education to students who are furthest from educational justice, resources, and opportunities in the Highline Public Schools and surrounding districts.",2023
"Mastery Transcript Consortium",684,"Mastery School of Hawken","Gates Mills","Ohio",NA,"This school has a fully implemented mastery-based learning system and uses the Mastery Transcript as the official summative record for some or all graduates.",2023
"NewSchools Venture Fund",719,"McClure Health Science High School","Gwinett County","Georgia","Gwinnett County Public Schools","McClure Health Science High School is a comprehensive, innovative health science high school that teaches the curriculum through the health science lens. We instill in all student the drive to be curious, the drive to create a promising future and a desire to have a positive impact on the world.",2023
"Big Picture Learning",309,"Met Sacramento High School","Sacramento","California","Sacramento City Unified School District","As a school in the Big Picture Learning network, this school supports the organizational mission of activating the potential of Schools, Systems, and Education through student-driven, real-world learning. Its design helps to scaffold and facilitate student learning aligned with the """"10 Expectations"""" (https://www.youtube.com/watch?v=K96c-TGnSf4) and it is organized to implement the """"10 distinguishers"""" (https://www.bigpicture.org/apps/pages/index.jsp?uREC_ID=389353&type=d&pREC_ID=902235) to deliver """"one kid at a time"""" personalized learning situated in the communities it serves.",2023
"Big Picture Learning",310,"Methow Valley Independent Learning Center","Winthrop","Washington","Methow Valley School District","As a school in the Big Picture Learning network, this school supports the organizational mission of activating the potential of Schools, Systems, and Education through student-driven, real-world learning. Its design helps to scaffold and facilitate student learning aligned with the """"10 Expectations"""" (https://www.youtube.com/watch?v=K96c-TGnSf4) and it is organized to implement the """"10 distinguishers"""" (https://www.bigpicture.org/apps/pages/index.jsp?uREC_ID=389353&type=d&pREC_ID=902235) to deliver """"one kid at a time"""" personalized learning situated in the communities it serves.",2023
"Big Picture Learning",127,"MetWest","Oakland","California","Oakland Unified School District","As a school in the Big Picture Learning network, this school supports the organizational mission of activating the potential of Schools, Systems, and Education through student-driven, real-world learning. Its design helps to scaffold and facilitate student learning aligned with the """"10 Expectations"""" (https://www.youtube.com/watch?v=K96c-TGnSf4) and it is organized to implement the """"10 distinguishers"""" (https://www.bigpicture.org/apps/pages/index.jsp?uREC_ID=389353&type=d&pREC_ID=902235) to deliver """"one kid at a time"""" personalized learning situated in the communities it serves.",2023
"NewSchools Venture Fund",720,"Montessori Elementary at Highland Park","Chattanooga","Tennessee",NA,"Our school model is to provide an authentic Montessori education. MEHP works with Project Based Learning and STREAM to incorporate an early childhood hands on learning model with the scientific method in elementary classrooms.",2023
"NewSchools Venture Fund",721,"MS 371 SEED: Harlem","New York","New York","New York City Department of Education","Cultivating thinkers and leaders to recognize their importance and responsibility as global citizens.",2023
"NewSchools Venture Fund",717,"MS 935","Brooklyn","New York","New York City Department of Education","M.S. 935 is a STEM based school in District 19 Brooklyn.",2023
"Big Picture Learning",312,"Nashville Big Picture High School","Nashville","Tennessee","Nashville School District","As a school in the Big Picture Learning network, this school supports the organizational mission of activating the potential of Schools, Systems, and Education through student-driven, real-world learning. Its design helps to scaffold and facilitate student learning aligned with the """"10 Expectations"""" (https://www.youtube.com/watch?v=K96c-TGnSf4) and it is organized to implement the """"10 distinguishers"""" (https://www.bigpicture.org/apps/pages/index.jsp?uREC_ID=389353&type=d&pREC_ID=902235) to deliver """"one kid at a time"""" personalized learning situated in the communities it serves.",2023
"Alliance for Catholic Education",135,"Nativity of Mary Catholic School","Bloomington","Minnesota",NA,"Nativity of Mary is reimagining its instructional core through Blended Learning Practices.",2023
"Transcend",793,"Navajo Preparatory School","Farmington","New Mexico","Navajo Preparatory School",NA,2023
"Transcend",601,"New Harmony High Institute","New Orleans","Louisiana","New Harmony High School","Place based learning. Use local environment to teach systems thinking, problem solving, and activism. Lots of partnerships, outdoor learning, active self-direction. I believe they were an XQ recipient and that the schooli is located on a barge outside of New Orleans? ",2023
"Big Picture Learning",139,"New Legacy Charter School","Aurora","Colorado","Aurora Public Schools","As a school in the Big Picture Learning network, this school supports the organizational mission of activating the potential of Schools, Systems, and Education through student-driven, real-world learning. Its design helps to scaffold and facilitate student learning aligned with the """"10 Expectations"""" (https://www.youtube.com/watch?v=K96c-TGnSf4) and it is organized to implement the """"10 distinguishers"""" (https://www.bigpicture.org/apps/pages/index.jsp?uREC_ID=389353&type=d&pREC_ID=902235) to deliver """"one kid at a time"""" personalized learning situated in the communities it serves.",2023
"NewSchools Venture Fund",786,"New School of San Francisco","San Francisco","California","New School of San Francisco","The New School of San Francisco is a tuition-free public school designed in partnership with local educators, parents, and community leaders. Inquiry, equity, and personalized learning are at the heart of how our students learn, grow, and thrive. We are currently serving Kindergarten through 8th grade. Our mission is to demonstrate a holistic 21st century education that instills a love of learning now and prepares students and families for success in the future. We believe in “Inquiry for All”—all children should go to school where they can drive their learning, ask big questions, and take risks. This belief fueled the creation of our school in 2015.",2023
"Big Picture Learning",316,"New Village Girls Academy","Los Angeles","California","Los Angeles Unified School District","As a school in the Big Picture Learning network, this school supports the organizational mission of activating the potential of Schools, Systems, and Education through student-driven, real-world learning. Its design helps to scaffold and facilitate student learning aligned with the """"10 Expectations"""" (https://www.youtube.com/watch?v=K96c-TGnSf4) and it is organized to implement the """"10 distinguishers"""" (https://www.bigpicture.org/apps/pages/index.jsp?uREC_ID=389353&type=d&pREC_ID=902235) to deliver """"one kid at a time"""" personalized learning situated in the communities it serves.",2023
"Big Picture Learning",317,"Newark East Side High School","Newark","New Jersey","Newark Public Schools","As a school in the Big Picture Learning network, this school supports the organizational mission of activating the potential of Schools, Systems, and Education through student-driven, real-world learning. Its design helps to scaffold and facilitate student learning aligned with the """"10 Expectations"""" (https://www.youtube.com/watch?v=K96c-TGnSf4) and it is organized to implement the """"10 distinguishers"""" (https://www.bigpicture.org/apps/pages/index.jsp?uREC_ID=389353&type=d&pREC_ID=902235) to deliver """"one kid at a time"""" personalized learning situated in the communities it serves.",2023
"Big Picture Learning",318,"Newburgh Free Academy West","Newburgh","New York","Newburgh Enlarged City School District","As a school in the Big Picture Learning network, this school supports the organizational mission of activating the potential of Schools, Systems, and Education through student-driven, real-world learning. Its design helps to scaffold and facilitate student learning aligned with the """"10 Expectations"""" (https://www.youtube.com/watch?v=K96c-TGnSf4) and it is organized to implement the """"10 distinguishers"""" (https://www.bigpicture.org/apps/pages/index.jsp?uREC_ID=389353&type=d&pREC_ID=902235) to deliver """"one kid at a time"""" personalized learning situated in the communities it serves.",2023
"Center on Reinventing Public Education",382,"Next STEP High","Lewiston","Maine","Lewiston Public Schools","This school exhibits strong partnership between a local youth-serving nonprofit and a public school to promote student voice and agency, mental health and SEL supports by employing community-based professional youth workers through the school district.",2023
"NewSchools Venture Fund",722,"Nichols Intermediate Academy of Leadership","Little Rock","Arkansas","ScholarMade Achievement Place","We use Emotional Intelligence and Personalized Learning as a lever to student achievement.",2023
"Center on Reinventing Public Education",452,"Nokomis Regional High","Newport","Maine","RSU19","Nokomis has dedicated over ten years to transforming its instructional model  to immerse students in meaningful learning experiences that relate to their interests and passions. Students learn through project-based learning, interdisciplinary courses, and career exploration units. Staff are encouraged to bring their expertise and interest into classes, and several have collaborated with each other to create interdisciplinary classes. ",2023
"Big Picture Learning",320,"North Bay Met Academy","Windsor","California","Windsor Unified School District","As a school in the Big Picture Learning network, this school supports the organizational mission of activating the potential of Schools, Systems, and Education through student-driven, real-world learning. Its design helps to scaffold and facilitate student learning aligned with the """"10 Expectations"""" (https://www.youtube.com/watch?v=K96c-TGnSf4) and it is organized to implement the """"10 distinguishers"""" (https://www.bigpicture.org/apps/pages/index.jsp?uREC_ID=389353&type=d&pREC_ID=902235) to deliver """"one kid at a time"""" personalized learning situated in the communities it serves.",2023
"KnowledgeWorks",537,"Northern Cass High School","Hunter","North Dakota","District 97","Attaching credit to competencies through personalized """"studios"""" at the middle level. Educators are embedding profile of a learner competencies in learning experiences at all levels.",2023
"Barr Foundation",747,"Nowell Academy","Providence","Rhode Island",NA,"Project-based learning with transformative learning experiences
Primary person model with academic counseling
Post secondary success planning with students",2023
"Center on Reinventing Public Education",747,"Nowell Academy","Providence","Rhode Island",NA,"Nowell is a student-first environment that offers several supports to students, including but not limited to on-campus daycare services for students with children and a primary person model that creates strong adult-student mentorship and relationships. The school rethinks traditional credit recovery opportunities through its transformative learning experiences, which are indterdisciplinary classes that give students double credits in subjects (e.g., Nowell's food revolution class gives students history and science credits). These classes also connect students to outside-school experiences (e.g., the social justice class visits the local court house and partners with lawyers from a local university, the food history class travels into local neighborhoods to map out food deserts to include a newsletter made available to students campus-wide). ",2023
"KnowledgeWorks",779,"Oakes Public School","Oakes","North Dakota","District 41","Oakes is using learning progressions to define entry points for learning and developing personalized learning pathways based on readiness",2023
"The Center for Learner Equity",675,"Odessa High School","Townsend","Delaware","Appoquinimink School District","Odessa high school uses a Pathways program that provides inclusive college and career pathways in which all students fully participate, regardless of their disability status or past performance. Students' experiences in their pathways are differentiated and tailored to student strengths, goals, and needs. The variety of industry partnerships the district has cultivated as part of this pathways program has helped leaders match all students with experiences that fit their strengths and goals. ",2023
