"nominator","school_id","school_name_n","school_city_n","school_state_n","school_district_n","nominator_reason_n","year"
"Anonymous",2,"Academies of Hampton","Hampton","Virginia","Hampton City Public Schools",NA,2019
"EdTech Specialists, LLC",5,"Alpena Career Tech Education Center","Alpena","Michigan","Alpena Public Schools","The Career Tech Education Center in Alpena is working with its community and businesses to create opportunities for their community that are changing the focus of the community as they grow and build new options for the work place and employment.  Alpena is a remote community, off the beaten path.  Their CTE program is ramping up meaningful ways for individuals and business to grow as they attract additional ways to generate revenue.  The CTE program is developing the work force for many of these opportunities.  As a recent recipient of several grants, including one for the states Marshall Plan, Alpena's CTE is providing high tech environments that will put Alpena on the map!",2019
"Highlander Institute",10,"Asa Messer Elementary School","Providence","Rhode Island","Providence Public Schools","Asa Messer is moving the needle in terms of supporting teachers as they implement a blended and personalized model in their classrooms. Each teacher is supported within one or two coaching cycles throughout the year. Support is offered through either an internal literacy/math coach or an external support partner, such as the Highlander Institute. These cycles of support are anchored in student data analysis, building plans for grade level teams or individual teachers as they address students varying needs. Another area of focus is the exploration of best practices and strategies to implement. A continuous improvement plan is utilized to help teachers, coaches and administrators analyze if the implemented practice is effectively working. Throughout the community, there is a culture that consistently supports all learners, both students, and adults, at whatever entry point. ",2019
"Anonymous",12,"Aspire Richmond Tech","Oakland","California","Aspire Public Schools","Focus on blended learning; part of high-quality charter network with proven results",2019
"Anonymous",13,"Atlanta Speech School","Atlanta","Georgia",NA,"Deep understanding of the science of learning drives practice; focus on relationships; excellent use of data to understanding each child's precise learning strengths and needs; eye towards exporting its learning for broader impact",2019
"Building Blocks Education",14,"Austin Road Elementary School","Stockbridge","Georgia","Henry County Schools","This school, in a very short period of time, has gone from providing traditional, teacher-centered instruction to empowering students to exercise agency in almost every aspect of their learning.  Students in every classroom (1) analyze their formative assessment data to determine what to work on, (2) set short-term goals to prioritize their work, (3) choose the resources and activities they use for learning, and (4) use formative assessments to determine when they're ready to move forward.  What stands out about this school's model is that students don't just make a few arbitrary choices, but exercise real agency in all of the meaningful aspects of their learning from start to finish.  Teachers have truly shifted their roles from telling students what to learn and how to learn it, to helping students drive their own learning.  Finally, the school has made rapid progress in implementing their model by setting consistent expectations for all teachers and providing school-wide professional development.  I'm excited to nominate this school because they show it's possible to transform instruction across an entire school in a short period of time.",2019
"Anonymous",17,"Aveson","Altadena","California","Aveson Charter Schools","Aveson Global Leadership Academy provides middle and high school students with the academic and leadership skills necessary to be leaders in the global community. Students graduate from AGLA having built a resume of academic success, social entrepreneurial experiences, and healthy living practices. These achievements are accomplished through a highly supportive advisory system within a democratic learning community. At AGLA, every student is empowered to be an active participant in their education through Aveson's Personalized Mastery Learning model. In Personalized Mastery Learning, teachers take on the role of Academic Advisors. Advisors, in conjunction with students, collaboratively design learning experiences in order to support students in achieving their goals.  Through Personalized Mastery Learning, students help dictate what and how learning happens. Additionally, students help determine when they are ready to demonstrate evidence of learning. Advisors are given the professional autonomy to personalize learning in order to optimize learning for every student.",2019
"Educurious",18,"Barbara Morgan STEM Academy","Meridian","Idaho","West Ada School District","This is a fully development STEM Project-Based Learning school.  Students drive their own questions and work on complex engineering designs.  They are a 1-1 school using technology in robust and effective ways.",2019
"EdTech Specialists, LLC",20,"Bedford Homeschool Partnership","Richland","Michigan","Gull Lake Community Schools","The Homeschool Partnership is leading the way the entire district addresses personalization.  Their attention to engaging the community in education their students while providing individual attention to students and their families is a model that is changing education in the Gull Lake Community Schools and across the state of Michigan.  It has led the district to developing a self-directed learning model that will go district wide.",2019
"EdTech Specialists, LLC",21,"Berrien Springs Virtual School","Berrien Springs","Michigan","Berrien Springs Public Schools","Berrien Springs established its virtual school over 10 years ago.  Over the 10 years, they have reached out statewide to provide infrastructures that meet the needs of students who otherwise would not have the opportunities for alternative ways to learn.  Their philosophy is to build programs around the student rather than the other way around.  Their attention to the social emotional needs of students is evident in the priority they have made to have social workers on staff for student needs.  ",2019
"Great Schools Partnership, Center for Artistry and Scholarship",22,"Blackstone Academy Charter School","Pawtucket","Rhode Island","Blackstone Academy Charter","The model at Blackstone is based on the Ten Common Principles from the Coalition of Essential Schools.  The school is deeply committed to learning for each student and rapidly implementing a robust proficiency system.

The small educational environment at Blackstone Academy Charter School (BACS) helps foster independent inquiry, teamwork, and communication. Students develop the skills to solve problems and use their voices in ways that lead to success in the academic, social, and professional arenas, and they demonstrate their achievements through a process of discovery, presentation, and reflection. BACS was founded in aligned with the Coalition of Essential Schools  educational philosophy and Common Principles.  Community involvement and community improvement are key themes at BACS. In addition to classes, BACS's portfolio system structures the progression of their learning by having students study themselves and their relationships to others, move forward with an exploration of the local community, and ultimately integrate an understanding of the wider world as students become responsible, motivated, life-long learners.  Although classes include traditional tests, learning is also assessed through presentations and exhibitions of student work. In addition to classes, students complete three portfolios and a major senior project. These portfolios require reflection upon the school's 13 Habits of Mind, are presented to a panel, and are an important part of its proficiency based graduation system.  Blackstone Academy's 13 Habits of Mind are: collaboration, community engagement, creativity, gratitude, grit, humility, integrity, optimism, organization, self-advocacy, upstanderness, wellness, and zest. Along with the school's emphasis on self-reflection, competency-based learning, and growth mindset, these habits of mind create the conditions for young people who would be off-track to complete high school on time and find success in higher education.",2019
"Anonymous",26,"Canon City High School","Canon City","Colorado",NA,"CTE and work-based, meet portfolio capstones, for all students.  Redesign of the only comprehensive high school in a rural community.",2019
"Highlander Institute",29,"Central Elementary School","Lincoln","Rhode Island","Lincoln Public School","Central Elementary School is located in the heart of the Lime Rock neighborhood of Lincoln, RI with approximately 375 students in grades kindergarten through grade 5.   Over the past three years, Central has implemented a school-wide blended learning approach to their teaching and learning. Focusing on a station rotation model in grades K-3 and mixture of a flex/station model in grades 4-5.  There are three components that drive the work at Central;  data-driven instruction, differentiation, and school culture,   Data-driven Instruction: Every teacher has been trained in and uses formative assessment to develop their lessons.  Teachers use a family of measures to guide their instructions: such-as exit tickets, anecdotal evidence, and student work samples.   Differentiation:  Teachers use a flexible grouping process determined by student classroom data to differentiate the learning environment for their students.  Station rotations allow students to personalize their learning and have a choice in the pace of their learning.  These stations are teacher-led, student-led, and include independent learning opportunities, affording students multiple pathways for success.  They meet as a whole group for broad concept instruction, in small group with the teacher or 1:1 with support personnel for more intensive instruction, and work independently applying their learning.  School Culture: The culture of Central Elementary is purposefully designed and developed by a team of teachers, the school psychologist, and the principal.  A Positive Behavior Intervention Support (PBIS) team meets monthly to monitor and guide the school culture of respect, responsibility, and safety to self and others.  Monthly assemblies are held that celebrate student successes.  A Growth Mindset Culture has been adopted throughout the school and in the classrooms to promote student growth through perseverance, application, and rich learning experience   ",2019
"Anonymous",31,"Charles R. Drew Charter School","Atlanta","Georgia","Atlanta Public Schools/Locally-Approved Charter",NA,2019
"Idaho Mastery Education Network - Idaho Department of Education",43,"Columbia High School","Nampa","Idaho","Nampa School District","Columbia High school incorporates instructional design choices that support student-centered learning and equity for all students. This strategic collaborative effort makes mastery education implementation available to students within a cohort learning model where teachers loop with students from grade level to grade level. This assures that learning never ends according to the calendar, but continues along a progression of skills that are transparent to students and teachers.  

Columbia has taken a unique approach as they implement Mastery-based Education in their school.  They are using a project-based, blended learning approach with a very specific gradual release plan.  Student voice and choice is central to their mission.  ",2019
"ReSchool",51,"Da Vinci Extension","Hawthorne","California","Da Vinci Schools","Created a college program as an extension of their HS programs in response to student and family demand. Started as a 5th year program and now an affordable, personalized way for kids to earn a 4 year degree.

Integration of homeschooling with place-based schooling",2019
"Anonymous",55,"Derry Elementary","Port Isabel","Texas","Point Isabel ISD","Exceptional commitment to pilot, sustain, and scale student centered blended learning for all students! ",2019
"Utah State Board of Education",60,"Duchesne High School","Duchesne","Utah","Duchesne School District","Duchesne County School District has established a solid foundation on which to build a Competency-Based Education program. We are well underway with establishing a standards-based grading system in which identifying priority standards, establishing pacing guides, and constructing proficiency scales are key components. These components will also be key components to our future Competency-Based Education plans. We have also developed an effective professional development system throughout our district following the pattern of Assessment to Achievement. This system includes our district team researching and developing the PD for School Transformation Teams. These school teams then present to their faculty and follow up with teacher to see that implementation takes place. We have successfully followed this pattern with such Evidence-Based Instructional Strategies as Questioning, Feedback, and Teacher Clarity. For the 2019-20 school year we will train our district in Personalized Learning. We want to expand on this to implement Competency-Based Education to secondary math, science, ELA, social studies, and CTE programs for the 2020-21 school year. From there we would like to implement CBE schoolwide in our secondary schools in 2021-22 and in elementary schools in 2022-23.",2019
"Next Gen Learning Challenges",61,"e3 Civic High School","San Diego","California","e3 Civic High","e3 came about through an extraordinary partnership of San Diego community groups, businesses, and government. It is housed in the new downtown main library building in truly spectacular physical space. Students make deep use of the library itself and many serve roles there as docents. The school has created a model that is a hybrid of many approaches we've seen in other NGLC schools. It is personalized, experiential, and places a high value on authentic work outside of the school; it has redesigned and articulated its definitions for student success; it has created new principles for what it means to be an e3 student that the students all appear to embrace; it makes great use of its next gen space and the proximity of the library and downtown San Diego. Students are able to speak with authority and real passion about the school and what it means to be a member of the e3 community. Most, maybe virtually all, students are involved in multiple forms of extracurricular and service projects. The head of school is a relentless problem-solver and opportunity-identifier and e3 has continuously refined and improved its model ever since its founding. It is a profoundly interesting place for other educators to visit.",2019
"Anonymous, Anonymous",66,"Ember Charter School for Mindful Education, Innovation, and Transformation","Brooklyn","New York","Ember Charter School","Deep cultural and identify focus. Centered on Afrocentric curriculum. Teacher pathways modeled after law firms where teachers are partners. Experiential / exposure model. New definitions and models of student success.

Rafiq and his team are intently focused on creating a beloved community in which all students feel affirmed. The team at Ember has built and intentionally mindful learning environment that prioritizes inquiry in academics and student social-emotional development.",2019
"National Center for Learning Disabilities",68,"Envision Academy","Oakland","California","Envision Education","Their capstone portfolio assessments",2019
"Educurious",74,"Strive Prep - Federal","Denver","Colorado","STRIVE Prep","This network of school is going to scale with social justice focused project-based learning with all social studies teachers. The teachers at Federal are leading this effort. They have wrap around services for students. Data is showing strong academic gains, increased social and emotional learning indicators and decreased discipline referrals.",2019
"Highlander Institute",82,"Garden City","Cranston","Rhode Island","Cranston Public Schools","As Garden City begins their third year of blended and personalized learning journey the work is beginning to throughout the building, from grade level to grade level, and teacher to teacher. Teachers are taking on leadership roles within their schools and throughout the district supporting and showcasing the work by opening their doors internally and to external visitors throughout the district. Teachers take the time to share out best practices and strategies to others, whether it is through district gatherings or staff meetings. The building is in the early stages of implementing innovative practices with the use of maker spaces. ",2019
"Anonymous",86,"Goochland High School","Goochland","Virginia","Goochland County Public Schools","Goochland High School has embraced the integration of technology and work-life ready experiences for every student.  Their forward thinking and their drive for excellent and quality education for all students is remarkable.",2019
"Educurious",87,"Green Valley Ranch","Denver","Colorado","STRIVE Prep","This network of school is going to scale with social justice focused project-based learning with all social studies teachers. The teachers at Green Valley Ranch are leading this effort. They have wrap around services for students. Data is showing strong academic gains, increased social and emotional learning indicators and decreased discipline referrals.",2019
"National Center for Learning Disabilities",92,"High Tech High","San Diego","California","High Tech High","Their project-based, student-driven approach and their capacity to capture long-term data for their students",2019
"Anonymous",96,"Holyoke High School","Holyoke","Massachusetts","Holyoke Public Schools","Turnaround high school - a rare example of high school turnaround that went through a """"blank slate"""" process to reimagine the high school model, rather than tinkering. Model includes thematic pathways that are intended to be an engagement hook to prepare all students for college and career opportunities. Deep and growing partnerships with several area colleges, emphasis on learning outside the school walls through internships, beginning to dismantle historic """"tracking"""" systems. Workshop model instructional focus.",2019
"Anonymous",99,"IDEA Toros College Preparatory","Edinburg","Texas","IDEA Public Schools","Network known for consistency and excellence; blended learning program; use of sports to build school culture and comprehensively develop students",2019
"Anonymous",107,"Ketcham","Washington","District of Columbia","D.C.","Could use this link: https://www.ketchamelementary.org/apps/pages/index.jsp?uREC_ID=929663&type=u  Intentional focus on growth mindset and supportive vs punitive environment",2019
"Anonymous",109,"KIPP Academy Lynn Collegiate","Lynn","Massachusetts","KIPP","On a journey to reimagine the high school experience - moving away from their more traditional models of instruction and culture. Thoughtful approaches to supporting students to and through college.",2019
"South Carolina Department of Education - Office of Personalized Learning",113,"Lexington 4 Early Childhood Center","Swansea","South Carolina","Lexington School District Four","The Early Childhood Center in Lexington 4 serves a critical need: a high quality whole child learning environment open and available to all pre-school age children in the community.  The Early Childhood Center uses Montessori to ensure a developmentally appropriate approach.  They also partner with parents and the community to provide a comprehensive approach to a whole child education.  Parents and teachers work together in a variety of ways and through a variety of specific structures the school has developed to ensure the experience is personalized for students and their families.  The Early Childhood Center is a focal point of the community and the district has been forward thinking in finding ways to invest so that the opportunity is available to every single student in the community between the ages of 3 and 5.  Teachers nurture student voice and the independence of these young learners is amazing to see in person.",2019
"Anonymous",114,"Liberty Elementary School","Baltimore","Maryland","Baltimore City Public Schools","90/90/90 neighborhood school. 90% minority, 90% FRL and 90% achievement. ",2019
"Illinois State Board of Education",115,"Lincoln Middle School","Berwyn","Illinois",NA,"In the fall of 2012, Berwyn North School District 98 schools were the lowest-performing schools among all those that fed into Morton West High School. District leaders set out to transform teaching and learning through culturally responsive practices to better engage their students, of whom 30 percent are English Learners and 90 percent are students of color. Berwyn North's Lincoln Middle School is now in the top 10 percent of all Illinois schools.       Berwyn North conducted both internal and external audits with all administrative, teaching, and support staff and with Berwyn families and community leaders to better understand their formative contexts and identify needs. The resulting professional development focused on five inclusive behaviors and how to integrate these behaviors into the classroom, including: how to give and receive feedback, how to be an advocate, how to make mutual contact, ways to value difference, and how to recognize underrepresentation. The entire staff participated in a book study of Zaretta Hammond's Culturally Responsive Teaching and the Brain.      The district developed a new, culturally responsive curriculum for all students through a teacher-driven process of deep alignment and shared assessments. Culturally responsive curriculum development means not only focusing on what is being taught, but how it is being taught to diverse learners, along with a deep analysis of why. Teams working on the curriculum included teachers and staff from every program, representing all student groups for equitable instruction. The district began working on a microcredential program in cultural responsiveness to track progress.    Page Break    Berwyn North developed a dual language program aligned to integrated English and Spanish language arts standards. Every student in Berwyn learns to read and write in one bilingual setting with all components presented in Spanish and English, with accommodations for special education students. ",2019
"Illinois State Board of Education",121,"Manual Academy","Peoria","Illinois",NA,"Visitors walking around Manual Academy's campus on the south end of Peoria School District 150 may see a few identical, carefully built wooden Adirondack chairs. These chairs are the proud handiwork of Manual Academy students and one example of the school project- and competency-based approach to education. Peoria School District 150 is part of Illinois' competency-based education pilot program. Manual Academy teachers and leaders have found that competency-based education allows students to take greater advantage of partnerships and opportunities with local businesses.       Global manufacturing giant Caterpillar is headquartered in Peoria and is one of the region's largest employers. Formerly a technical high school, Manual Academy partners with Caterpillar to prepare students for careers in manufacturing technologies. Caterpillar provides donated supplies, volunteer mentorships, a welding camp, and a $300,000 grant to support a full manufacturing curriculum co-taught at Manual Academy and Peoria's Caterpillar plant. Competency-based education also paved the way for innovative programs like Fuse Studio, a hands-on engineering lab where students choose their own projects.      Students in the Caterpillar Hiring Innovation Program learn academic concepts through hands-on experiences from painting to assembly and the most popular applied skill, welding. Students learning welding are positioned to have the skills to achieve American Welding Society certification before graduation. Engineering and industrial technology teachers spend one day a week with students and mentors at Caterpillar to supervise and track student learning goals. They track student communication and collaboration alongside trade skill milestones. The curriculum concludes with a direct pathway to real manufacturing jobs with Caterpillar upon completion. Other students go on to college with increased social-emotional skills, confidence, and direction.  ",2019
"Anonymous",123,"Maple Street Magnet School","Rochester","New Hampshire","Rochester School District","Multi-age classrooms; project-based learning; student co-design",2019
