"nominator","school_id","year","nominator_reason_n"
"Anonymous",1,2019,"The level of personalization in the online environment."
"Anonymous",2,2019,NA
"NewSchools Venture Fund",3,2023,"A team of dedicated teachers and leaders, working in a high performance and caring culture, maintains an intense focus on academic achievement and performance outcomes. Students find success and are engaged through personalized learning, which allows students to work at their own pace and learn in a way more suited to their strengths. We hold high expectations for students and staff and believe everyone can create their future."
"Anonymous",4,2019,"Albemarle Road Elementary, in the large, urban Charlotte-Mecklenburg district, uses the Opportunity Culture model. The school """"exceeds growth"""" under the state definition. An Opportunity Culture school extends the reach of excellent teachers and their teams to more students, for more pay, within the school's recurring budget. Multi-Classroom Leadership is the foundation of an Opportunity Culture; multi-classroom leaders (MCLs) lead a small teaching team, providing instructional guidance and frequent, on-the-job development, while continuing to teach part of the time. The schools redesign schedules to provide additional school-day time for teacher planning, coaching and collaboration. MCLs typically lead the introduction of more effective curricula, instructional methods, classroom management and schoolwide culture-building. Accountable for the results of all students in the team, multi-classroom leaders earn substantial pay supplements, within the regular school budget. The school design teams reallocate school budgets to fund pay supplements permanently, in contrast to temporarily grant-funded programs."
"EdTech Specialists, LLC",5,2019,"The Career Tech Education Center in Alpena is working with its community and businesses to create opportunities for their community that are changing the focus of the community as they grow and build new options for the work place and employment.  Alpena is a remote community, off the beaten path.  Their CTE program is ramping up meaningful ways for individuals and business to grow as they attract additional ways to generate revenue.  The CTE program is developing the work force for many of these opportunities.  As a recent recipient of several grants, including one for the states Marshall Plan, Alpena's CTE is providing high tech environments that will put Alpena on the map!"
"EL Education",6,2019,"STEM, project-based learning, SEL embedded in academics, culturally-relevant pedagogy, student-engaged assessment (student-led conferences, portfolios, etc)"
"Mastery Transcript Consortium",7,2024,"This school has implemented a competency-based learning model and is or will soon be publishing Mastery Transcripts or MTC Learning Records as summative records for some or all graduates."
"ReSchool",8,2019,"micro school, learning genome cards to personalize learning, independent school so freedom to do things not possible in public schools, great leader"
"Michigan Department of Education",9,2019,"They are now looking at the big picture and have switched from teacher-centered to student-centered. The school now includes 21st Century skills, and students are required to take a two-year career sequence. The school now also offers Career Technology Education (CTE) courses. The school has discussions about what students can and can't do with specificity, rather than just looking at test results."
"Highlander Institute",10,2019,"Asa Messer is moving the needle in terms of supporting teachers as they implement a blended and personalized model in their classrooms. Each teacher is supported within one or two coaching cycles throughout the year. Support is offered through either an internal literacy/math coach or an external support partner, such as the Highlander Institute. These cycles of support are anchored in student data analysis, building plans for grade level teams or individual teachers as they address students varying needs. Another area of focus is the exploration of best practices and strategies to implement. A continuous improvement plan is utilized to help teachers, coaches and administrators analyze if the implemented practice is effectively working. Throughout the community, there is a culture that consistently supports all learners, both students, and adults, at whatever entry point. "
"Moonshot EdVentures",11,2021,"Entrepreneurial curriculum; students have to have owned and operated a business before graduating in 8th grade; spends time on financial literacy"
"Anonymous",12,2019,"Focus on blended learning; part of high-quality charter network with proven results"
"Anonymous",13,2019,"Deep understanding of the science of learning drives practice; focus on relationships; excellent use of data to understanding each child's precise learning strengths and needs; eye towards exporting its learning for broader impact"
"Building Blocks Education",14,2019,"This school, in a very short period of time, has gone from providing traditional, teacher-centered instruction to empowering students to exercise agency in almost every aspect of their learning.  Students in every classroom (1) analyze their formative assessment data to determine what to work on, (2) set short-term goals to prioritize their work, (3) choose the resources and activities they use for learning, and (4) use formative assessments to determine when they're ready to move forward.  What stands out about this school's model is that students don't just make a few arbitrary choices, but exercise real agency in all of the meaningful aspects of their learning from start to finish.  Teachers have truly shifted their roles from telling students what to learn and how to learn it, to helping students drive their own learning.  Finally, the school has made rapid progress in implementing their model by setting consistent expectations for all teachers and providing school-wide professional development.  I'm excited to nominate this school because they show it's possible to transform instruction across an entire school in a short period of time."
"Education Evolving",15,2019,"Although Avalon's student body is not racially diverse, the schools attracts many students who were looking for a school environment that supports their well-being (100% of parents and 97% of students say Avalon is a safe and a positive learning environment, and many students are from the LGBT community). They also serve a high needs population, with 36% of Avalon students identified as special education.  Avalon uses a teacher cooperative model. Their teacher team has autonomy in all 15 potential areas and their board has a teacher majority.   The Avalon teacher team chooses to use a self-directed project-based learning program and 360-degree teacher evaluation. They have have very low teacher turnover rates (5.3%). They also take seriously the notion of educating the whole child, and along with traditional assessments use the Hope Survey to assess students' non-academic outcomes, such as self-efficacy, optimism, and problem-solving ability, so the teacher team can evaluate what areas of school design the team needs to adjust in order to better help its students improve these outcomes.  The teacher team believes it is important to model collaborative leadership to their students and therefore decided to make the student body a voting branch of the school government, with students passing bills (for example, on acceptable cell phone and school attendance policies). Teachers secure autonomy via: charter school contract and school bylaws."
"EdVisions",15,2019,"Very innovative personalized approach to learning.  No set courses, entirely project-based and experiential. Teacher-run. Student safety is priority. Social justice focus."
"Center for Teaching Quality (CTQ)",15,2019,"This is a long-standing teacher-powered school that serves many students who may have a difficult time in traditional school settings. They get amazing student outcomes and focus on the individual learning and social-emotional needs of students."
"Education Reimagined",15,2019,"Avalon serves a high percentage of learners with special needs or IEPs (nearly 30%), and has also become an informal hub for young people who are wrestling with gender or sexual identity issues. It is a teacher-powered charter school that serves middle and high schoolers. It has a commitment to flexible staffing and deep professional learning among staff to better serve the needs of its learners. They are competency-based, allowing learners to identify and develop projects that meet their interests. They are also committed to allowing learners to develop agency and ownership of their learning, accounting for this transition on the part of learners who may take months to settle in, but then accelerate into their competency-based program to complete on time. Allowing fluidity by not having grades (freshman, junior, senior) makes this more possible. The school does a lot to expand the universe for learners, making connections in person and virtually to people who can help learners with projects. Learners develop a real sense of project development, pacing, time management and self-reliance through this process."
"Anonymous",16,2019,"The school's mission is to help create growth, both academically and emotionally. This is important for their goal of creating citizens of an equitable, democratic society. The school is focused on arts education and arts integration, and also includes a focus on personalization, and """"habits of mind and heart"""".  The school also mentions social justice as an important theme across the school. Personalization happens through personal relationships with teachers and other students, self-reflection, student choice, demonstrations of mastery (rather than grades), and the role of the teacher (as a coach rather than a """"sage on the stage""""). """"Habits of mind and heart"""" are """"critical thinking, mindfulness, compassion, reflection, connection, responsibility, communication, quality, resiliency, joy, integrity, inspiration, and creativity."""" Students are regularly asked to reflect on these qualities, even within class assignments.  "
"Springpoint Schools",17,2021,"Aveson Global Leadership Academy is a tuition-free charter school that employs a very thorough mastery approach, while focusing on personalization and projects. Serving students in grades 6 through 12, the school embodies the core principles of rigor, relevance, and relationships.Â   Students graduate from AGLA having built a resume of academic success, social entrepreneurial experiences, and healthy living practices. These achievements are accomplished through a Mastery Learning Portfolio (MLP) complemented by a highly supportive advisory system within a democratic learning community. AGLA has iterated on their model and deeplyÂ values student voice, offering explicit opportunities for student agency. Student led-conferences are one manifestation of this. Adults not only support students to prepare, but link the school's communications competencies to student-led conferences. At AGLA, educators understand the deep relationshipÂ between mastery and student agency.  The school has been doingÂ competency-based learning for many years and has a mature set of competencies. AGLA develops a personalized learning plan for each student, and they utilize teachers (called Academic Advisors) and paraprofessionals (called Project Managers) in unique ways. Adults track data on every student, including student progress, as well as interestÂ areas and supports theyÂ have received.outcome tracker.Â As well, there are regular celebrations when students reach key milestones, including formative and summative celebrations of learning and anÂ interdisciplinaryÂ capstone project.Â They focus on mastery, use of rubrics, student agency, and peer-to-peer assessment."
"Educurious",18,2019,"This is a fully development STEM Project-Based Learning school.  Students drive their own questions and work on complex engineering designs.  They are a 1-1 school using technology in robust and effective ways."
"Highlander Institute",19,2019,"As a Lighthouse School, Barrington Middle School is enhancing its practices around personalization and developing transformational learning opportunities that occur at the intersection of: deeper learning, experiential learning, and project-based learning. The school is committed to making explicit connections between classroom learning and the application of that learning beyond school walls. Barrington has taken on the responsibility to prepare students to be contributing successful global citizens, who also have strong academic knowledge for success.  Barrington Middle School students go deep in their learning and apply it to authentic problems and real-world situations using deeper learning competencies that push students' to: Master core academic content, think critically and solve complex problems, work collaboratively, communicate effectively, learn how to learn, and develop academic mindsets. Experiential learning at Barrington provides guaranteed learning opportunities in all grades and classrooms in which students can demonstrate, apply, and transfer their knowledge and skills across content and setting. Students are given opportunities to engage in self-directed project-based learning that allows them to describe what and why they are learning, track and improve their progress, and connect their learning outside of the classroom. For example, students develop products and business plans to pitch to the community in a shark tank setting, or research areas of interest and report their findings and calls to action to authentic audiences."
"EdTech Specialists, LLC",20,2019,"The Homeschool Partnership is leading the way the entire district addresses personalization.  Their attention to engaging the community in education their students while providing individual attention to students and their families is a model that is changing education in the Gull Lake Community Schools and across the state of Michigan.  It has led the district to developing a self-directed learning model that will go district wide."
"EdTech Specialists, LLC",21,2019,"Berrien Springs established its virtual school over 10 years ago.  Over the 10 years, they have reached out statewide to provide infrastructures that meet the needs of students who otherwise would not have the opportunities for alternative ways to learn.  Their philosophy is to build programs around the student rather than the other way around.  Their attention to the social emotional needs of students is evident in the priority they have made to have social workers on staff for student needs.  "
"Barr Foundation",22,2023,"Proficiency based learning
Social and emotional learning
Advisory
Public presentations and portfolio
Community improvement projects
Culturally responsive practices"
"Global Teaching Project",23,2019,"The Advanced Placement (AP) Access Pilot Program is an innovative and first-of-its-kind blended learning program that provides promising high school students access to the advanced coursework they need to achieve their full potential, but which rural, underserved schools such as Booneville High School otherwise could not offer due to limited resources and a chronic, and worsening, shortage of qualified teachers. With the support of the Global Teaching Project, the Pilot Program provides comprehensive, wraparound services to students and teachers, including access to world-renowned subject matter experts, such as Yale University Physics Professor Meg Urry, as well as college-student tutors from leading institutions including MIT, Stanford, Yale, and Virginia, enabling Booneville High School to leverage its existing resources to provide advanced courses to bright, but underserved students.  In addition to these unique human resources, the blended model also provides students the opportunity to participate in intensive, residential preparatory programs throughout the year at local MS-based universities including the University of Mississippi and Mississippi State University. The Global Teaching Project is excited to nominate Booneville High School because of the tremendous efforts it is undertaking to provide historically underserved students access to AP courses. Notwithstanding Booneville's significant challenges, the blended learning model has made remarkable initial progress: classroom teachers are engaged and gaining both substantive and pedagogical experience; students are tackling rigorous subject matter (AP Physics 1 is the program's inaugural course) with initial performance data showing promising results; and, perhaps most importantly, students are beginning to reimagine themselves as part of a high-achieving, academically ambitious cohort.  As the model expands and continues to improve, the program will help to develop and prepare a pipeline of talented, high-achieving students from Mississippi's most rural and impoverished districts for post-secondary success."
"Education Evolving",24,2021,"Mission and Vision: Boston Day and Evening Academy re-engages off-track students in their education preparing them for high school graduation, post-secondary success and meaningful participation in their community. Boston Day and Evening Academy will continue to be an innovative leader in student-centered education for off-track learners. Highlights: Competency Based Education-  The primary--and the crucial difference between a competency-based system of teaching and assessment and a traditional model, is that students begin a learning pathway (traditionally referred to as middle school or high school) based on assessed skill level in each content area, and not on arbitrary placement in grades (based on age). Each content area (i.e. Humanities, Math, Science, Technology) is divided into modules, which correspond to an academic semester, quarter, or trimester (see ROADMAP). After being assessed for their knowledge in each content area, students are placed into the module which puts them at their """"learning edge"""" i.e. challenging, but not overwhelming. Students progress from module to module in each content area, based on their ability to demonstrate mastery in each area, independently and multiple times. Once they meet the assigned benchmarks in each module, they become """"competent"""", and move on to the next module. If they finish a trimester without demonstrating competency in an area, they repeat that module--and that module only--while moving ahead in other content areas. Innovative Teaching Practices In addition to using competency-based teaching and assessment practices to drive the curriculum and inform the learning that takes place at BDEA, faculty are constantly embracing new forms of teaching that address the student-centered nature of their work. Blended Learning- We are thoughtful about how we are using technology to enhance learning, and hear from students that they need a balance of technology and personalized, teacher-led instruction.  Our approach has been to create a blended learning model that combines a variety of options including online courses, as well as technology-supported classes enhanced by the use of iPads, Smartboards and computers.  We have a Personalized Online Learning Lab (POLL) where students can catch up on classroom work or accelerate their progress through classes. But the bottom line is always having teachers available for support, direction, and conversation. Experiential Learning- For over a decade, BDEA has included Project Month as a way of turning all classes """"experiential"""", and giving students--and teachers--an opportunity to collaborate on projects that become an enduring part of the whole-school community.  One year, one of the projects turned an abandoned community clubhouse into a solar powered, hydroponic greenhouse. Another year, students engaged with the """"Occupy Boston"""" movement and recreated the experience of tent living, media coverage, and the genesis of the Arab Spring in a series of connecting classrooms at the school.   Active Learning- Active Learning takes many forms, from the expected inclusion of physical fitness into the everyday experience of our staff and students, to the authentic learning experience that results from theatrical movement classes taught by valued partners Actors' Shakespeare Project.   Our partners at Project Adventure helped us to understand and incorporate important aspects of """"active"""" learning into our teaching practice, coaching students to physically """"move through"""" diagrams  instead of writing them on a whiteboard, and to use space rather than fill it."
"reDesign",25,2019,"Asynchronous model with teachers playing a mentor role"
"LLC",25,2019,"This is a school for at-promise youth in NYC. The model is competency-based, blended-learning, highly personalized, and a highly unusual school design. Their students enter the school overage and under-credited, and despite this, 80+% of the graduating class enrolls in college, and of this group, 80% of students persist beyond the freshman year. "
"Springpoint",25,2019,NA
"Anonymous",25,2019,"Bronx Arena High School is a transfer school serving over-age, under-credited students. The school is a collaboration between the Department of Education and SCO Family Services, a social service agency that provides social and emotional support, as well as college counseling. Students are paired with """"advocate counselors"""" from SCO Family Services. Students work through a web-based mastery system at their own pace, and receive 1:1 and small-group support from teachers in flexible """"arena"""" blocks. Each arena has a generalist teacher and an advocate counselor, both of whom support students academically and personally throughout the day. Students also work with content specialists, who push in during the day to provide additional one-on-one or small group instruction in particular areas. Generalists and content specialists collaborate closely and analyze data to ensure all students are receiving the supports they need to be successful. The school combines online learning with face-to-face instruction in a method pioneered by Principal Ty Cesene at an alternative school in El Segundo, California. Bronx Arena develops its curriculum materials in-house, through a rigorous faculty review process. Technology components, specifically a custom-built data system accessible to students and staff at all times, create a personalized experience where students work at their own pace, mastering the skills needed to succeed in the 21st century. Students track their own productivity and work toward completing five learning tasks per day. To receive credit for a course, students must demonstrate mastery by completing two challenges and a capstone project. Students complete senior portfolios on a topic of their choice that represents a culmination of their learning."
"Colorado Education Initiative",26,2022,"Canon City High School offers the most compelling set of coherent, aligned career connected learning experiences to the students it serves that I have ever seen. Starting with robust career pathways which are core-curriculum aligned, to the comprehensive career and technical education program which results in 100s of industry certifications, to the P-TECH program, where students graduate with both a high school and associates degree, to the internship program, in which every student participates, to the """"Capstone for All"""" graduation requirement - where every student demonstrates competence in the Canon City """"Skills and Traits"""" graduate profile.  There is even a """"school within a school"""" Open Pathway for students who don't connect with the offered career pathways. This is the most complete, most equitable, and more authentic district school experience I know of."
"Great Schools Partnership",27,2021,"Casco Bay has tied together project-based learning using an EL model with proficiency-based learning in an environment that is extremely student centered. Students are known as individuals and while there are common learning expectations for all students, teachers work to build upon each student's skills and capacities. Students learn agency along with deep content and skills"
"Next Generation Learning Challenges",27,2021,"Casco Bay is a wonderful example of a school creating its own successful version of a very successful national school and learning template -- the EL Schools model. It is a district school, not a charter, in the Portland public schools and so is subject to all of the same regulations, policies, and contracts that all regular public schools are subject to. And yet the experience its students have at Casco Bay is very different than the """"normal"""" experience most kids have in schools these days. Casco Bay, like all EL schools, is very deeply experiential and project-based -- most learning is connected to some form of authentic purpose. It has done exceptional work in thinking about and designing ways to gauge student growth across a number of dimensions not normally on the radar in public schools. It is doing all of this work with a student body that -- while it has opted into the school -- reflects much of the diversity, complexity, and challenges  that many public schools must address right now. We have brought teams of educators to Casco Bay many times over the past five years and these educators routinely leave feeling inspired and with a whole new view of what schools can be. A video of Casco Bay's community grappling, in typically student-led ways, with a racist incident was featured in our recent virtual film festival, This Is Our Chance. See """"Walking in Solidarity"""" on this page of the festival site: https://our-chance.com/week-1/."
