"nominator","school_id","year","nominator_reason_n"
"Anonymous",636,2023,"Waxpool Elementary staff and leadership meet regularly to collaborate and reflect on the learning experiences their students are engaged in. They seek to leverage the diversity of their school community as an asset and connect with their local community in authentic ways to ensure that school is authentic, relevant and meaningful to their students. They have operationalized their internal professional learning to be true communities of practice and established norms, expectations and structures that support teacher collaboration and professional practice. "
"Anonymous",637,2023,"Mr. Klippel has done an incredible job of building the capacity of his teacher leaders and has a unique gift in identifying talent and leveraging that in service of high quality student outcomes. Their laser focus on equity and culturally responsive practices is admirable, as they are always willing to take a critical look at their successes and themselves to uncover potential gaps in achievement based on student subgroup populations. They are a PBL school through in through, with teachers aspiring to be """"on project"""" often, but even when not, alway running PBL classrooms, centering student voices in all they do. "
"Moonshot EdVentures",638,2023,"The school centers the experiences and needs for neurodiverse students but is inclusive for all kids. There is high parent and family engagement. Students receive intensive mental health supports (2 counselors for 60+ students), movement and SEL courses each morning, and teachers trained in Precision Teaching. "
"Anonymous",639,2023,"Great use of Montessori coupled with authentic learning environment that represents the background of its students and families"
"Clayton Christensen Institute",640,2024,"The program is flexible to students learning needs."
"Fannie Lou Hamer Freedom High School",641,2023,"An amazing school in poorest congressional district in the country that is a model of progressive education."
"Fannie Lou Hamer Freedom High School",642,2023,"Located in poorest congressional district in the country, AASSAB is an excellent progressive performance assessment school that works with overaged, under credited students. "
"NewSchools Venture Fund",643,2023,"Our school will empower students to be leaders through combining rigorous & relevant academics with social-emotional learning. We put all of this together through our Entrepreneurial Project-based Learning, where students learn not only from their teachers and peers, but also directly from scientists, lawyers, engineers, and designers."
"Transcend",643,2023,"""""DeKalb Brilliance Academy is a new school that combines rigorous & relevant academics with social-emotional learning. They put all of this together through Entrepreneurial Project-based Learning, where students learn not only from their teachers and peers, but also directly from scientists, lawyers, engineers, and designers.

The school's design principles are rigor and relevance, real-world projects, building leadership, honoring identities, exceptional teaching, and collaborative partnerships."""""
"New Tech Network",646,2024," To create a school of innovative creators where all members of the community are respected and all students have warm demanders as facilitators, Compass Academy implemented new cultural practices at both the learner and adult level to establish a more supportive and inclusive culture. School leadership, teachers, and staff challenged students to embrace high standards for learning and college/career planning. Evidence for advancing student-centered learning can be observed with the adoption of and adaption of Marzano High Reliability Schools™ framework as a part of student, faculty and staff recognitions; using the framework indicators to empower their school teaching staff and students (Source: Marzano, R. J., Phil Warrik, and Julia A. Simms. A Handbook for High Reliability Schools: The Next Step in School Reform. Marzano Research, 2014.)  By adopting such a framework, the school has expanded the framework of standards to include competencies with performance assessments and academic skills that are transferable across content areas. Compass Academy students know exactly where they are and what they need to do next. This is an important component to enhancing supportive and inclusive culture experiences as this added “a level of fun and engagement that [the school] did not predict. It’s been an excellent investment in the human capital of Compass Academy.”  This leading indicator can be seen in action through restorative practice in the classrooms, using the “Good Things” protocol from Capturing Kids’ Hearts (Capturing Kids’ Hearts: A Three-Year Program Evaluation, 2016-17 to 2018-19, May 2020, https://files.eric.ed.gov/fulltext/ED606969.pdf).  The “Project Expo” (senior capstone projects) allowed for new and potential students to share their best projects of the year to the public and school board; demonstrating Compass Academy’s school teaching tenets alignment to project-based learning.  

"
"Kentucky Department of Education",647,2023,"The Ignite Institute is a model for community partnerships and flexible scheduling to allow scholars the flexibility to explore career pathways and core curriculum content. Before high school graduation, each scholar will have the opportunity to spend 400+ hours with regional companies learning on-the-job skills. These experiences will allow our students to begin networking with local businesses. This relationship is a crucial element in creating a workforce pipeline for the region. The school is structured by colleges: Biomedical and Allied Health, Computer Science, Design, Education, Engineering, and Logistics. Learning is centered around personalized, project-based experiences that provide scholars with authentic, relevant learning opportunities."
"Anonymous",648,2023,"Student involvement and personalized learning."
"MiCoOp",649,2023,"To reduce the number of failed classes, missing assignments, and low attendance, Portland Middle School created a more structured transition from elementary school to middle school. All sixth-graders start and end their day with their homeroom teacher, have physical education, and stay with the same core teachers all year long. During the intervention/enrichment block on the schedule, students get what they need…either support in math and/or reading or an enrichment opportunity. A common planning time for sixth-grade teachers allows time for collaboration and reflection on current practices and results. Sixth-grade students also start the school year one day before the rest of the middle school."
"MiCoOp",650,2023,"Hamilton High School has a work-based learning graduation requirement. Throughout their high school years, students must complete career activities every year. Students can choose activities they do on their own like a college visit or career fair and/or participate in school-related activities such as the school store class. The activities are categorized into Awareness, Exploration, Preparation, and Training. Students can be excused from school to attend an event or do an activity if they complete the appropriate forms ahead of time. To graduate, students must complete three tasks in the Preparation and Training categories, with at least one from Training. With the large variety of options to choose from, students can plan their own career paths."
"MiCoOp",651,2023,"Calumet Middle School started a Flex Lab in the 2022-23 school year. Every student has Flex Lab in their schedule right before and after lunch. During this time, students receive intervention or enrichment. Every teacher is also scheduled for Flex Lab before and after lunch. This gives students the opportunity to meet with any teacher during that time whether it’s for additional assistance or to go deeper. Enrichment options also include a maker space."
"MiCoOp",652,2023,"Portland High School moved to a 4×4 block schedule for the 2022-23 school year. A personalized hour, called Plus 1 (+1), is scheduled for the last part of the day to allow students to explore careers, engage in work-based learning, get involved in community partnerships, or seek additional help to catch up if needed. These credit/no-credit experiences allow students to investigate career and personal interests without the fear of traditional grading consequences like GPA. Plus 1 hour has been intentionally structured to provide additional opportunities for all students to receive increased academic support (Tier 1 or Tier 2) without impacting their graduation status."
"KnowledgeWorks",653,2023,"Using a collaborative and diverse representation of stakeholders for establishing lead design team(s) to create their equity and student-centered instructional framework aligned to their guiding principles, beliefs, and the district's portrait."
"Vermont Agency of Education",654,2023,"At Colchester High School academic credit is awarded upon demonstration of proficiency in learning experiences through courses and other non-traditional learning experiences. In courses, students have the opportunity to demonstrate the knowledge and skills for proficiency through a variety of learning experiences and assessments. Each department has delineated two to eight discipline-specific proficiencies that a student is required to meet for graduation. When a student receives credit for a particular course that is an indication that the proficiencies have been met. Taken together, the proficiencies or credits gained will provide a cumulative body of evidence that students have met overall school-wide and discipline-specific graduation expectations and are ready to graduate. 
 

 All students at CHS develop a Personalized Learning Plan. This plan documents a CHS student’s journey. The options for students include but are not limited to, community service, outside coursework, student aide assignments, work-study, independent study, online learning, Advanced Placement courses, Technical Centers, Dual-Enrollment courses, Early College, and internships. In addition, students may apply to Target Graduation, an outcomes-based graduation program, or may apply to attend Colchester Alternative Program (CAP) a smaller learning environment.
 

 The work of educators at Colchester High School is guided by the following Core Beliefs:
 ● We engage in diverse learning experiences rooted in relationships, relevance, rigor, and shared responsibility.
 ● We work together to build on one another's strengths and perspectives.
 ● We cultivate a strong and connected community that respects and celebrates all Lakers.
 ● We demonstrate respect and compassion for ourselves, one another, and our school.
 ● We create safe spaces where all Lakers can thrive.
 ● We empower all Lakers to use their voice, pursue their aspirations, and be active and engaged members of our community.
 

 Educational decisions are guided by the belief that proficiency-based learning practices in an environment of strong support for students’ social and emotional needs will enable them to meet these expectations."
"Disruptive Partners",655,2023,"The entire model is designed to nurture the natural born genius of Black children. This significantly Disrupts the traditional K12 narrative that leads with the deficit of Black children."
"Anonymous",656,2023,"Lucama Elementary and its district are part of the national Opportunity Culture initiative, in which schools extend the reach of excellent teachers and their teams to many more students, for more pay, within regular budgets. Under Principal April Shackleford, Lucama dramatically “exceeded growth” in 2021–22 under the state definition. The foundation of the Opportunity Culture model is the Multi-Classroom Leader role, or MCL—an excellent teacher who leads a small teaching team, providing instructional guidance and frequent, on-the-job development, while continuing to teach part of the time. Under Shackleford, Lucama creatively used resources to take this role and other team teaching roles schoolwide in its second Opportunity Culture year to shift student learning and school culture, and to involve as many teachers, paraprofessionals, and retired teachers serving as paid tutors as possible in providing small-group instruction, to give students in this Title I school equitable access to tutoring during and after school."
"Anonymous",657,2023,"Petree Elementary and its district are part of the national Opportunity Culture initiative, in which schools extend the reach of excellent teachers and their teams to many more students, for more pay, within regular budgets. Petree went from failing to meet state expectations for student learning growth in 2018 to exceeding growth in 2022, and was removed from the state’s list of low-performing schools. The foundation of the Opportunity Culture model is the Multi-Classroom Leader role, or MCL, an excellent teacher who leads a small teaching team, providing instructional guidance and frequent, on-the-job development, while continuing to teach part of the time. Petree creatively used resources to implement this and other team teaching roles to reach more students with excellent instruction, and is continuing to use resources carefully to expand those roles despite the lowered funding that comes as a consequence of being removed from the low-performing list, so that students can continue to make strong growth."
"Anonymous",658,2023,"Ross Elementary and its district are part of the national Opportunity Culture initiative, in which schools extend the reach of excellent teachers and their teams to many more students, for more pay, within regular budgets. Under Principal Susan Hendricks, Ross moved from being an “F” school in 2019 to receiving a “C” overall and a “B” for growth in 2021–22. The foundation of the Opportunity Culture model is the Multi-Classroom Leader role, or MCL, an excellent who leads a small teaching team, providing instructional guidance and frequent, on-the-job development, while continuing to teach part of the time. Under Hendricks, Ross creatively used resources to take this role schoolwide and give MCL teaching teams the support of advanced, higher-paid paraprofessionals, to provide more small-group instruction. The school culture has shifted as well, leading to strong teacher retention rates after the school previously had very high turnover—all helping to provide students with greater access to excellent instruction."
"Alliance for Catholic Education",659,2023,"St. Patrick's is transforming its instructional core to be aligned with Blended Learning Practices."
"Deeper Learning Equity Fellowship",660,2023,"As a school community, One World Middle School has reimagined the learning of what education looks like in how students experience school as a whole. At the foundational core, they believe that students have the right to a quality and innovative standards-based education, the right to know and be known in a safe and welcoming environment, and the right to be acknowledged as unique individuals who learn differently. These core beliefs promote and advance equity and student-centered learning throughout the school. It is evident upon walking through the halls, the classrooms, and interacting with the students that their core beliefs live and breathe through how they view the purpose of education and the instructional core, and the structures they deem important.
 

 One World Middle School has proven that in order to have a reimagined equitable learning environment, two components must be in place: a safe learning environment and a staff that knows who the children are and their individual needs. To support this idea they have implemented practices and events such as Ambassador Day, Unit 0, and Developing the Whole Child Meeting (DWC). Ambassador Day is quite the experience as students across all grades are given the opportunity to select their mentors for the year. During this particular day, students engage in community-building activities by spending the entire day in small groups with their teacher mentor discussing their commonalities and differences and learning to embrace each other diversity and strengths. Throughout the year the mentors meet weekly to plan and conduct themed-based activities. For example, in November and December, mentor groups coordinate events and activities around gratitude and acts of kindness respectively. These student-led initiatives have taken different forms over the years from groups creating donation drives, reading to students at neighborhood elementary schools, making edible treats that are distributed to fellow peers, volunteering at Senior Health Centers to simply redesigning a classroom space. 
 

 In thinking about how to continually engage students and to make sure all learners see themselves in the curriculum, One World Middle School acknowledges and celebrates the various cultural, racial, ethnic, and gender diversity that comprises the school community through their first unit of the year. One World Middle School in all grades and content areas uses the first unit of the year which is called Unit 0 to focus on student identity and understanding the child. In addition, there are weekly meetings programmed called Developing the Whole Child (DWC) where teacher teams create action plans for ambassadors who may need support academically, socially, or emotionally. These strategies are often grounded in the Pre-referral Intervention Manual (PRIM) or Adaptation for Adolescents with Autism and Asperger's manual (A-5) to tailor the support to effectively meet the needs of the student. The teams continually discuss the outcomes of the strategy with each other as well including the student for their input. Teams reflect on progress as they monitor the impact on student learning.  
 

 At One World it is evident that they are thoughtful about the language they use with their students and in their space. It is a common belief that the process for creating an atmosphere of mutual respect and trust that equitably supports the academic and personal growth of students and adults begins with language which is clearly intertwined in the fabric of the school. The school truly believes that the words students encounter on daily basis, they will in turn embody. Thus, students are addressed as ambassadors because they are encouraged and provided with opportunities to be agents of change. The word ambassador coincides with the school's construction as they operate under a United Nations model where ambassador voices are influential in the way the school functions and the changes that occur. An example of a system in place is the school's embassy delegates which include members from all grades that meet biweekly with the principal. These meetings range from discussing issues and making suggestions, to planning events such as LGBTQ Coming Out Day, Autism Awareness Day, or Breast Cancer Awareness Day which is driven by the consensus of the student body. These student-centered planned events foster a level of self and others. Every morning during morning assembly the school gathers together to proclaim as one voice, """"I want today to be one of the greatest days of my life"""" to establish a positive feeling and tone for the day. As a mantra, to work and live by, the school leadership believes and promotes that each year they must create a learning environment and community that is more impactful than the previous year. 
 

 It is without a doubt, that the ambassador's academic outcome is at the core of One World Middle School's instructional focuses and practices. They have demonstrated that ambassadors learn best when they have an opportunity to collaborate with peers and then make their thinking visible. Practices in place to support that students constantly engage with other students start with the structure of how the room is designed. At One World all classes are designed to accommodate a variety of grouping configurations. These configurations support opportunities over the course of a lesson for ambassadors to engage in turn and share and work on group assignments as well as projects in a seamless manner. Teachers have collaborated on phased protocols to promote partner discussions. As a best practice, all classrooms are equipped with two certified teachers to ensure that on a daily basis all needs of their children are met. Teachers take a less active role in talking in the classroom being mindful of the fact that the one that is speaking, is the one doing most of the learning. Therefore, in a One World classroom ambassadors are often engaged in discussions about the planned tasks, and activities in an effort to meet the day's objective where the teachers utilize a series of questions or prompt to cognitively challenge students thinking to either spark ambassador questions or to promote metacognition. 
 

 Ambassadors making connections and providing opportunities is an extremely critical component of the school. For example, the entire student body annually engages in Science Day where ambassadors take their learning to design experiments and projects. Additionally, all students participate in a school-wide dissection that is tiered by grade to investigate the systems, and scientific benefits to society and to ponder the ethical consequences. All ambassadors in the 8th grade take high-school level courses (Living Environment, US History, English 11, Algebra). As a result, 8th graders start their high school careers a grade ahead which allows them to have access to a college course for free or graduate a year early. Students at One World have the opportunity to visit colleges they have expressed interest in that are located locally and across state lines. Some of the colleges toured include Boston College, Harvard, Yale, SUNY Oneota, Howard, and many others. From touring colleges students who have graduated have enrolled in colleges such as Boston College and other SUNY programs. Through their expeditionary trips to monumental sites in history, like Selma, Gettysburg, and The Capitol ambassadors have been able to make connections to topics discussed in their classes.
 

 Other practices that are embedded at One World include a dedicated department and common planning time for teachers to meet, plan and revise units that are tailored specifically for the students they teach. Student-initiated clubs and student electives where ambassadors get an opportunity to express their interests and preferences for electives in a series of exit interviews."
"228 Accelerator",661,2023,"I am really interested in how we can reimagine different uses of space and curricular design to create a more culturally responsive and relevant learning experience. I think that part of the answer lives in schools that are challenging some of the design assumptions of the modern school experience."
"4.0 Schools",662,2023,"At Capitol Learning Academy, all students receive a personalized curriculum focused on the mindsets and technology needed to be adaptable lifelong learners. They have a vision for CLA acting as a lab school for innovative practices that can be shared and scaled to DC public and charter schools."
"4.0 Schools",663,2023,"DC's first dual immersion public charter, Global Citizens offer Spanish and Mandarin. Located in Ward 7, GCPCS pairs language immersion with a focus on social justice and whole child wellness, to equip children to become empathetic, globally competent, and socially-minded leaders."
"NewSchools Venture Fund",663,2023,"Global Citizens Public Charter School is the first dual language immersion elementary school in Washington, DC, to offer language immersion in both Mandarin and Spanish pathways - exposing students to the top three languages spoken in the world."
"4.0 Schools",665,2023,"The Capital Experience Lab makes use of all the resources DC has to offer, while closing the opportunity/access gap for local students. Their model helps students apply their learning and use their creativity in contexts beyond the classroom."
"Anonymous",666,2024,"I Dream Public Charter School co-designs purposeful, self-directed learning with children and families, so they have voice and choice on the path to discovering and pursuing their dreams."
"4.0 Schools",667,2023,"Capital Village is an intentionally small community where student-led projects blend Common Core standards with local social justice problems which students are empowered to design solutions for."
"Anonymous",668,2023,"Heartwood Agile Learning Center is a K-12 independent school that facilitates Self-Directed Education. We use adaptable tools and practices borrowed from the Agile Management/Software world and consent-based decision-making to help students individualize their learning within the context of a collaborative and intentional community.
 

 Heartwood ALC is committed to amplifying the sense of agency and the social conscience of our young people. We encourage them to explore their passions and curiosities to help them simultaneously discover and create their path in life. At Heartwood, relationship is one of our biggest values because we take a whole community approach to helping our students self-actualize. Facilitators, parents, and students all work together to feed and maintain a healthy school culture.
 

 We also have a special focus on equity and social justice to ensure that self-directed education is accessible and empowering for all people, especially populations that have been historically disenfranchised."
