"nominator","school_id","year","nominator_reason_n"
"Arkansas Team Digital",198,2021,"For the last three years, Stuttgart Jr. High has been implementing blended learning to meet students' needs. They provide online and in-person instruction with opportunities for students to have some element over their time, place, path, and/or pace. Recently, they implemented a flex day on Wednesdays into their schedule. Students arrive at school with a personalized playlist that is preloaded in their LMS by the teachers. The students decide what content they need extra support on or if they need to partner up with peers to collaborate on a project. The educators support student learning by meeting student' needs through a variety of methods of instruction. They have opportunities to do project-based learning, cooperative learning, and making relevant connections to improve learning outcomes. From what I have observed, student success is at the forefront of Stuttgart Jr. High."
"Anonymous",199,2019,"Competency based progression is a central practice of Summit schools.  Students move through their 'playlists' at their own pace, and move on only once content knowledge mastery is demonstrated.  However, progression based on competency is constrained to content and projects within a school year, that is, students advance grades, and pursue their respective courses, as an age-based cohort.  For content learning, students decide when they're ready to take assessments, receive immediate feedback, and can review materials or practice to incorporate the feedback, and then re-assess when they're ready.  During project time too, teachers check in with students to give feedback as needed. Learner autonomy and agency are a priority in Summit schools.  Students have a fair amount of independent control over their learning time in school, and are scaffolded in this self-regulation through check-ins with teachers and their mentor.     "
"Illinois State Board of Education",200,2019,"Defined STEM helps students in Kankakee School District 111 make connections between their interests, the skills and activities they do in school, and possible careers. Every year at Taft Elementary School begins with an introductory poll of all kindergarten and first-grade students, asking one question: What do you want to be when you grow up? Taft's Principal Terrence Lee told the Illinois State Board of Education: """"Let's say a kid says they want to be Batman, and typically we'd say, 'No that's not a career.' But if you think about it, Batman's a millionaire, an entrepreneur, a businessman, and he saves people. We can tap into some of those things to say, 'How did Bruce Wayne become Batman?' Later on, we can lead this child into a career strand in human services or business management."""" Defined STEM includes quarterly inquiry-based science, technology, engineering, and math projects. Students follow the Goal, Role, Audience, Situation, and Product (GRASP) model, which offers a rubric for assessment and self-assessment of learning proficiency for each project. These projects are guided by the career focus, which branches out into specific career strands for each grade to explore. Project-based learning is supplemented by visits from professionals working in those particular fields, as well as field trips and real-world learning opportunities. Students begin using a program called Naviance in the sixth grade. Naviance is a learner-centered, personalized college and career readiness tool that helps students explore the career paths that best suit their working styles and passions. Defined STEM and Naviance ensure students are prepared to maximize the competency-based education structure at Kankakee High School and seek learning opportunities at school or in the community that fit their personalized self-directed paths. Kankakee School District 111 is part of Illinois' competency-based education pilot program. "
"Evergreen Education Group",201,2019,"Use of individual learning plans, community collaborations, arts and other labs, well-rounded approach for the students they are serving"
"Educurious",202,2019,"Fully project-based, STEM elementary school.  Has achieved STEM certification from AdvancED.  Has a maker space for students. Uses technology in deep and effective ways."
"228 Accelerator",203,2019,"The mission of The Creative School (formerly The Boys Institute) is develop young men characterized by hope, self-discipline, integrity and love; in the pursuit of justice and equity for their community, greater DC, and eventually the world. It is a school within a school that is centering entrepreneurship and creating a relevant maker space to enable the holistic development of black boys."
"EdSurge",203,2019,"The Creative School (formerly The Boys Institute) at Stanton Elementary School, is an initiative designed to promote wellness and creativity, and to flip the narrative around young boys of color. In 2016, D.C. Public Schools awarded nearly $1.7 million dollars in innovation grants to 16 schools across the city as part of the Empowering Males of Color initiative, an effort to elevate the student experience for young men and boys of color. Stanton Elementary School received the sixth largest award to develop and launch The Boys Institute (TBI), an in-school and after-school program designed to guide young boys of color in building a strong sense of identity and self-pride, to grow a village of supportive adults in their lives and to provide opportunities and spaces for creative expression. (See more here: https://www.edsurge.com/news/2018-08-24-elementary-school-wellness-program-helps-young-males-of-color-cultivate-their-identities)"
"Big Picture Learning",204,2023,"As a school in the Big Picture Learning network, this school supports the organizational mission of activating the potential of Schools, Systems, and Education through student-driven, real-world learning. Its design helps to scaffold and facilitate student learning aligned with the """"10 Expectations"""" (https://www.youtube.com/watch?v=K96c-TGnSf4) and it is organized to implement the """"10 distinguishers"""" (https://www.bigpicture.org/apps/pages/index.jsp?uREC_ID=389353&type=d&pREC_ID=902235) to deliver """"one kid at a time"""" personalized learning situated in the communities it serves."
"Big Picture Learning",205,2023,"As a school in the Big Picture Learning network, this school supports the organizational mission of activating the potential of Schools, Systems, and Education through student-driven, real-world learning. Its design helps to scaffold and facilitate student learning aligned with the """"10 Expectations"""" (https://www.youtube.com/watch?v=K96c-TGnSf4) and it is organized to implement the """"10 distinguishers"""" (https://www.bigpicture.org/apps/pages/index.jsp?uREC_ID=389353&type=d&pREC_ID=902235) to deliver """"one kid at a time"""" personalized learning situated in the communities it serves."
"Mastery Collaborative",206,2019,"TYWLS-Astoria is the most well-developed mastery-based learning school in New York State. This K-12 school has been perfecting its mastery systems and coursework for more than 10 years, and students' metacognition and self-direction shows the depth of this work. This school has 10 schoolwide learning targets: Argue, Be Precise, Collaborate, Communicate, Conclude, Create, Discern, Innovate, Investigate, Plan. All learning in all courses at the school is framed within this system of schoolwide outcomes. There are discipline-specific, spiraled learning targets nested under each outcome, aligned vertically for grades 6-12. Students get feedback about their progress and crucial next steps to improve their mastery. In student-led conferences, learners show mind-blowing metacognition, and are confident and clear about how to improve, and about their own ability to improve, because they see learning as a process and a journey. The school offers intensives midyear, a way for students to dive deeply into interesting, highly specialized coursework that is inquiry-driven and project-based. Educators at TYWLS-A are expert collaborators, constantly driving each other to improve, strengthen, deepen, clarify, and enrich their pedagogical work. The fruit of this labor of love is clear in a student body that is reflective, collaborative, metacognitive, and agentic. Visiting TYWLS-A and sitting in on classes and student-led conferences is a """"bucket list"""" experience for anyone interested in competency-based learning. The staff's already excellent practices and constant iteration to improve, as well as the school's elegant, clear, and effective system of schoolwide learning outcomes and discipline-specific targets, are a model for schools across New York City and the United States. "
"NYC Department of Education",206,2019,NA
"CSSR (Center for Secondary School Redesign)",207,2019,"Springdale is the 2nd largest school district in Arkansas.  The District obtained a waiver from the State to create Don Tyson School of Innovation (DTSOI) which was was based on a desire to move to student centered, competency based education.  DTSOI has benefited from the district transition from methodologies that were largely teacher-directed, and teacher-centered, towards a student-centered learning environment that promotes student voice and choice. The school includes a focus on an Anytime Anyplace vision for learning particularly the work that the district had to do to allow for flexible scheduling and flexible pacing within Arkansas' highly regulated education climate. Student learning is personalized by grouping students in """"School of Innovation Institutes"""" that are aligned by career and educational interest.   School of Innovation Institutes:   â‚¬?	Business, Information Technologies, Environmental/Alternative Energy, EAST, Robotics/Mechatronics, Craft Skills, Medical Services, Agriculture Advisory:  At School of Innovation our overall mission is to empower students through personalized education.  At the heart of this mission is our advisory program.   â‚¬?	Through advisory, every student will be in a small group of peers that is facilitated by a caring School of Innovation staff member.    â‚¬?	This group will stay together through the tenth grade year working on personalized learning plans, career exploration, community partnerships, and team building activities.  Beginning the eleventh grade year, advisors may change depending on focus/area of study.   â‚¬?	The purpose of advisory is to empower students through mentoring relationships and ownership over learning.   â‚¬?	Advisory is the place where all students have a chance to be known, understood, and encouraged toward their future goals.  "
"TRIO Wolf Creek Distance Learning Charter School",208,2022,"Wolf Creek Online High School has been a leader in creating high quality, equitable curriculum options for over twenty years for students. In this time of growing virtual needs many are looking for models of course design, personalization and relationship building in a virtual world, Wolf Creek provides just this to many in our community."
"Center on Reinventing Public Education",209,2022,"Two Rivers PCS is a notable example of project-based learning, personalization, deeper learning, and innovative assessment."
"Education Evolving",210,2021,"UCLA Community School has a diverse student population; 80% identify as Latino, and 14% Asian. 81% of students are classified as FRPL. 75% of elementary students and 41% of middle and high school students are English Language Learners. The teacher team has hiring autonomy and has chosen well-qualified colleagues that reflect the diversity in their student population. 51% of teachers identify as Latino (including the principal) and 22% Asian; 88% of teachers are bi- or tri-lingual. The school serves as a research school for UCLA's Center X and benefits from having a close working relationship with a top university as a full community partner at their school site. The teacher team chooses to have multi-age classrooms where students stay with each teacher for two years. As an immersion school, students are taught in English, Spanish, and Korean in elementary school. UCLA Community School uses an innovative assessment portfolio system for each student to track their growth academically. Students are highly involved in knowing, understanding, and plotting their own data. Under the teacher team's leadership, UCLA Community School students have been very successful. Students outperform the district in many areas including progress toward graduation. The overall college-going rate is now up to 95%. Teachers secure autonomy via a pilot school agreement between the district and union. The pilot agreement gives school governing boards autonomy in five areas (staffing, budget, curriculum & assessment, governance, and school calendar); at some schools, including UCLA Community School, this autonomy is passed on to the teacher team."
"Learning Policy Institute",210,2021,"UCLA-CS is a dynamic community school with a strong focus on equity and a longstanding partnership with UCLA. It is one of LAUSD's first pilot schools and shares the Robert F. Kennedy campus (the site of the former Ambassador hotel) with 5 other small schools. The UCLA-CS curriculum offers interdisciplinary project-based learning with a focus on social equity and performance-based assessment. The school has a collaborative governance model and strong community partnerships."
"Mastery Collaborative",211,2019,"UA Maker uses a unique structure for learning that combines mastery-based approaches and design thinking principles. It is an unscreened school, so students come from all over NYC, and enter with a wide variety of abilities. Students are asked to approach their learning as a process they own, which involves hands-on, collaborative and independent work, targeted coaching on skills, and iteration using both design thinking and mastery as frameworks to understand the criteria for success, and the process they will use to achieve it. Classes are lively and project-based, and the school offers a much-used maker space. This model works for a diverse student body, who report feeling more confident, more cognizant of how to make progress, more able to use questioning and design thinking to support their learning, and more aware of their own capabilities."
"NYC Department of Education",211,2019,"UA Maker is a highly diverse school in NYC, both with regard to race/ethnicity, and socio-economic status. With a maker/design-thinking approach, and a competency-based model, the school has found ways to meet their students where they are, and successfully prepare them for post-secondary life."
"reDesign, LLC",211,2019,"UA Maker, within The Urban Assembly Network, believes the world needs problem solvers who can find and solve challenges to create positive change. UA Maker aims to empower students not only to be successful, adaptive citizens of the future, but also to create that future through design thinking and innovation. The UA Maker community prioritizes the core values of curiosity, empathy, risk taking, self-awareness, and resilience. The school launched as part of the Opportunity by Design initiative, funded by Carnegie Corporation of New York and supported in their model design work by Springpoint. Teachers and students work together to help students demonstrate mastery of content and skills. Grades at UA Maker provide precise, actionable feedback about students' ability to master the design thinking process, content knowledge and the skills they need to be truly college and career ready. A strong advisory program and weekly check-ins, called """"self-awareness days,"""" help students develop the agency and skills needed to direct their own learning. The school's robust partnership network connects students to unique, real-world opportunities that help them develop 21st-century workplace skills."
"Springpoint",211,2019,NA
"Rogers Family Foundation",212,2023,"Oakland's only tuition-free public Montessori school, TK-8. Multi-age classrooms, two teachers in every room, expanded learning opportunities, and an in-house Montessori training program creating a career ladder for existing staff."
"EdVisions",213,2019,"Very innovative personalized approach to learning driven by unique and transformative personal learning plans.  No set courses, entirely project-based and experiential.  Teacher run. "
"Anonymous",214,2019,"Their entire school has moved forward together in their personalized-learning process."
"Anonymous",215,2024,"Valor's Compass model fosters holistic human development— including key physical, cognitive, emotional, and spiritual disciplines—through a focus on community and relationships as well as individual identity work."
"Anonymous",216,2024,"Valor's Compass model fosters holistic human development— including key physical, cognitive, emotional, and spiritual disciplines—through a focus on community and relationships as well as individual identity work."
"Anonymous",217,2019,"Personalized learning approaches; universal design for learning"
"Anonymous",218,2019,"This school has worked to integrate Project Based Learning and Design Thinking to create an innovative 20% time model to meet the needs of their students."
"Anonymous",219,2019,"Working closely with partners through the Highland Economic Partnership, Warren County High School has spent several years developing high-quality career options for students. Recognizing its rural location and that half of its over 2000 students will directly enter the workforce, school and district leaders built several new pathways through the career and technical education programs of study. Programs in mechatronics, health sciences, and telecommunications give students exposure to industry demands and real-world problems. Students also have the opportunity to earn industry certifications in skills that regional employers have identified as high-demand."
"Anonymous",220,2019,"Washington Leadership Academy (WLA) puts students onto life trajectories toward leadership in whatever roles they choose in tomorrow's world. How? By building trusting relationships and giving students unprecedented opportunities to learn and lead. Students at WLA take rigorous core classes, enriched by real-world experiences and access to experts, as well as student-selected projects and electives, all combined with the latest in technology and innovation. All WLA students take Computer Science and get hands-on experience with emerging technology, including virtual/augmented reality. WLA combines civic education, social justice education, and support for students as they explore who they are and where they want to go in life. Driven by an approach to teaching and learning that is both """"high tech"""" and """"high touch,"""" WLA is making a true difference for students in Washington, D.C., and beyond. "
"Charter School Growth Fund",220,2019,"WLA's instructional model was designed to optimize personalization and rigor of instruction given each content area and the current state of the edtech market (both content and tools). In practice, this means that instruction looks different from subject to subject. In content-heavy subjects, i.e. History, WLA will utilize a flipped classroom model. In subjects that require both remediation and skills develop, i.e Math and English, WLA will implement a two-day split with one section focused on grade-level content/instruction and the second section focused on remediation. The specifics of each are listed below, but each subject implements different tools and teacher practices to maximize results."
"Anonymous",221,2019,"Fully integrated STEM approach, multi aged"
"Anonymous",222,2019,"The commitment to student centered blended learning for all students!"
"Mastery Collaborative",223,2019,"West Side Collaborative Middle School uses a powerful, student-centered pairing of mastery-based and culturally responsive education practices. WSC has a strong and supportive school culture that nurtures young learners, and helps them to build community together, and mindsets for learning individually. Students at this school are uniquely resilient, secure and engages across the full arc of learning. They are free to make meaningful choices about their own learning, and they grow personally/academically through exploration and reflection. WSC personalizes academic opportunities for each child. Students are active participants in their own learning and collaborate with teachers in a cycle of rigorous individualized goal-setting, planning, evaluation and revision. WSC has a 1:1 laptop model, and infuses all subject areas with technology. Their Advisory program, Community Meetings, Personal Growth Labs build community and student agency. Small class sizes, block scheduling and flexible groupings allow for personalized attention and scheduling to fit students' individual needs. Student-led conferences and portfolio presentations are both ways to engage families and [offer] rich demonstrations of learning."
"NYC Department of Education",223,2019,NA
"CT Center for School Change",224,2019,"West Woods Upper Elementary School is a grade 5-6 school with an enrollment of approximately 600 students. The school implements a student-centered approach aligned to Farmington's improvement design. Curriculum, instruction, programming, and assessment are aligned to purpose-driven, socially-constructed, mastery-based and self-directed learning. One specific example to share is FLEX time. FLEX time is a challenge and support block developed by WWUES teachers. FLEX time provides students with a menu of options to select from that are both teacher and student directed. Choice is a key element of the design and student-engaged assessment practices drive a self-directed model of challenge and support within this innovative model. Two years after this teacher-led innovation was developed, Farmington is implementing this design across K-8 schools. Clear standards and data driven decision-making are a key feature of WWUES' student-centered approach. All standards for the week are clearly articulated and the student work from the week provides the body of evidence that demonstrates student progress towards those standards. While many of the offerings are based on academic standards, they are not exclusively so. Sessions can focus on learner mindset, Vision of the Graduate skills, organization, or any other social/emotional or executive functioning skills that teachers identify as an area of need. Student self-reflection, voice and choice is key to this daily block. Students are given tools and feedback to assess their own strengths and needs and are trusted to make wise choices about how to most effectively make use of the time and support they are provided. Students who have met the standards are given the opportunity to exceed the standard by working on the standard at a more advanced level. WWUES implements a mastery-based approach to empower students as leaders of their own learning. Farmington's mastery-based principles are implemented in all classrooms. "
"Illinois State Board of Education",225,2019,"Dr. Lazaro Lopez, then principal of Wheeling High School, met with manufacturers, business leaders and the local department of economic development in 2007 to address the shortage of skilled workers in the region needed to meet workforce demand. That partnership gave birth to the Township High School District 214 Career Pathways program. District 214 prepares its students for college and careers through experiential learning in 16 career clusters and 44 career pathways. The Career Pathways program currently serves more than 12,000 students from six comprehensive high schools, including Wheeling High School, and four specialized learning programs. District 214 purposefully eliminated the distinction between core courses and technical and career education courses. As many as 85 percent of District 214's students graduate having taken a college course, and two-thirds have completed nine semester hours of college credit by the time they graduate, an opportunity for considerable savings in tuition costs. Ninety-five percent of the district's students identify a career area of interest by graduation. Students have logged more than 2 million hours of workplace learning. The Educator Prep career pathway has served as a statewide model for addressing the teacher shortage. The teaching cluster begins with a sequence of high school courses that provide students an early feel for education as a career. Students who continue with the program earn early college credits and spend several days a week teaching lessons in actual K-12 classrooms under the close supervision of a master teacher. Students then can continue in the Educator Prep program with a postsecondary partner and earn a bachelor's degree and a teaching license. The district provides a network of supports for students while in college to increase the likelihood they graduate and become teachers. The district guarantees each student first access to interview for district teaching jobs. "
"Education Resources Consortium",226,2021,"Eager, ambitious. Moving beyond """"PBL"""", """"blended learning"""" and """"competencies"""" to interdisciplinary projects, an Inquiry Tool Kit, new structures and practices, A vision of a very unique and different school for 2025."
"Anonymous",227,2019,"The purpose of the K-12 school network (they will open about 20 schools around the world) is to inspire students to be global citizens who are adept, creative and curious about being lifelong learners.  Each school's curriculum will reflect and capitalize on the expertise of the city in which it is located."
